id,naslov,leto,ocena,oznaka,cas,opis,cena,zasluzek
0089276,La historia oficial,1985,7.7,Not Rated,112,"During the final months of Argentinian Military Dictatorship in 1983, a high school teacher sets out to find out who the mother of her adopted daughter is.",,69832
0090329,Prica,1985,7.4,R,112,"While protecting an Amish boy - who is the sole witness to a brutal murder - and his mother, a detective is forced to seek refuge within their community when his own life is threatened.",12000000,68706993
0090203,The Trip to Bountiful,1985,7.4,PG,108,"In 1940s Texas, an elderly woman is determined to visit her childhood home one last time.",,7491903
0089424,Kiss of the Spider Woman,1985,7.3,R,120,A gay man and a political prisoner are together in a prison. The gay man narrates the stories of two fake movies and his own life.,,17009654
0089560,Mask,1985,7.2,PG-13,120,A teenager with a massive facial skull deformity and biker gang mother attempt to live as normal a life as possible under the circumstances.,8000000,48230162
0091867,Soba z razgledom,1985,7.2,Not Rated,117,"Lucy Honeychurch (Helena Bonham Carter) shares a brief romance with George Emerson in Florence. Yet as she tries to move on with her life and look for marriage elsewhere, can she truly forget the events of that summer?",3000000,21043507
0089755,Moja Afrika,1985,7.1,PG,161,"In 20th-century colonial Kenya, a Danish baroness/plantation owner has a passionate love affair with a free-spirited big-game hunter.",31000000,227514205
0088740,Artie Shaw: Time Is All You&#x27;ve Got,1985,7.0,,114,"Documentary cataloging the life and music of the band leader and clarinetist, Artie Shaw.",250000,
0088933,Cocoon,1985,6.7,PG-13,117,"When a group of trespassing seniors swim in a pool containing alien cocoons, they find themselves energized with youthful vigor.",17500000,85313124
0089841,Cast Prizzijev,1985,6.7,R,130,Two professional assassins fall in love.,16000000,26657534
0088857,Broken Rainbow,1985,6.7,,70,"Documentary chronicling the government relocation of 10,000 Navajo Indians in Arizona.",,
0090319,White Nights,1985,6.6,PG-13,136,"A Russian American ballet dancer&apos;s airplane is forced to land in USSR, where he&apos;s &quot;repatriated&quot;. He stays with an American man married to a Russian. Will the American help him flee USSR?",20000000,42160849
0090605,Osmi potnik 2,1986,8.4,R,137,"Decades after surviving the Nostromo incident, Ellen Ripley is sent out to re-establish contact with a terraforming colony but finds herself battling the Alien Queen and her offspring.",18500000,131060248
0091763,Vod smrti,1986,8.1,R,120,"Chris Taylor, a neophyte recruit in Vietnam, finds himself caught in a battle of wills between two sergeants, one good and the other evil. A shrewd examination of the brutality of war and the duality of man in conflict.",6000000,138545632
0091167,Hannah in njeni sestri,1986,7.8,PG-13,107,"Between two Thanksgivings two years apart, Hannah&apos;s husband falls in love with her sister Lee, while her hypochondriac ex-husband rekindles his relationship with her sister Holly.",6400000,40084041
0091064,Muha,1986,7.6,R,96,A brilliant but eccentric scientist begins to transform into a giant man/fly hybrid after one of his experiments goes horribly wrong.,15000000,60629159
0091530,The Mission,1986,7.4,PG,125,Eighteenth-century Spanish Jesuits try to protect a remote South American tribe in danger of falling under the rule of pro-slavery Portugal.,24500000,17503446
0090557,&#x27;Round Midnight,1986,7.4,R,133,"A troubled, but talented musician flees the US to escape his problems, finding refuge and support in Paris.",3000000,3272593
0090830,Children of a Lesser God,1986,7.2,R,119,"A new speech teacher at a school for the deaf falls in love with the janitor, a deaf woman speechless by choice.",10500000,31853080
0090576,De aanslag,1986,7.2,PG,141,"A Dutch doctor, haunted by grueling childhood memories of World War II, struggles to find peace as he spends his life looking for answers about the tragic night that shaped him.",,512403
0090863,Barva denarja,1986,7.0,R,119,"Fast Eddie Felson teaches a cocky but immensely talented protégé the ropes of pool hustling, which in turn inspires him to make an unlikely comeback.",14500000,52293982
0092099,Top Gun,1986,6.9,PG,109,"As students at the United States Navy&apos;s elite fighter weapons school compete to be best in the class, one daring young pilot learns a few things from a civilian instructor that are not taught in the classroom.",15000000,357288178
0094226,Nedotakljivi,1987,7.8,R,119,"During Prohibition, Treasury agent Eliot Ness sets out to stop ruthless Chicago gangster Al Capone, and assembles a small, incorruptible team to help him.",25000000,76272360
0092603,Babettes gæstebud,1987,7.8,G,103,"During the late 19th century, a strict religious community in a Danish village takes in a French refugee from the Franco-Prussian War as a servant to the late pastor&apos;s daughters.",,4637920
0093713,Pelle erobreren,1987,7.8,PG-13,157,"When his wife dies, Lasse takes his 12-year-old son, Pelle, from their home in Sweden to Denmark in search of a better life.",,2063688
0093389,The Last Emperor,1987,7.7,PG-13,163,"Bernardo Bertolucci&apos;s Oscar-winning dramatisation of the life story of China&apos;s last emperor, Pu Yi.",23000000,43994979
0093870,RoboCop,1987,7.6,R,102,"In a dystopic and crime-ridden Detroit, a terminally wounded cop returns to the force as a powerful cyborg haunted by submerged memories.",13000000,53427575
0094291,Wall Street,1987,7.3,R,126,"An impatient young stockbroker is willing to do anything to get to the top, including trading on illegal inside information taken through a ruthless, greedy corporate raider who takes the youth under his wing.",15000000,43848069
0093565,Moonstruck,1987,7.2,PG,102,"Loretta Castorini, a bookkeeper from Brooklyn, New York, finds herself in a difficult situation when she falls for the brother of the man she has agreed to marry.",15000000,80644712
0092890,Umazani ples,1987,7.1,PG-13,100,"Spending the summer at a Catskills resort with her family, Frances &quot;Baby&quot; Houseman falls in love with the camp&apos;s dance instructor, Johnny Castle.",6000000,214577242
0093260,Mikrokozmos,1987,6.8,PG,120,"A test pilot is miniaturized in a secret experiment, and accidentally injected into a hapless store clerk.",27000000,25893810
0093148,Harry and the Hendersons,1987,6.1,PG,110,The Henderson family adopt a friendly Sasquatch but have a hard time trying to keep the legend of &apos;Bigfoot&apos; a secret.,10000000,49998613
0095765,Novi kino Paradiz,1988,8.5,PG,174,A filmmaker recalls his childhood when falling in love with the pictures at the cinema of his home village and forms a deep friendship with the cinema&apos;s projectionist.,5000000,13020497
0095953,Dezevni clovek,1988,8.0,R,133,"After a selfish L.A. yuppie learns his estranged father left a fortune to an autistic-savant brother in Ohio that he didn&apos;t know existed, he absconds with his brother and sets out across the country, hoping to gain a larger inheri...",25000000,354825435
0095647,Mississippi v plamenih,1988,7.8,R,128,Two F.B.I. Agents with wildly different styles arrive in Mississippi to investigate the disappearance of some civil rights activists.,15000000,34603943
0096438,Kdo je potunkal Rogerja zajca,1988,7.7,PG,104,"When a cartoon rabbit is accused of murder, he enlists the help of a burnt out private investigator to prove his innocence.",70000000,329803958
0095341,Hôtel Terminus,1988,7.6,Unrated,267,"A documentary about Klaus Barbie, the Gestapo chief of Lyon, and his life after the war.",,
0094721,Beetlejuice,1988,7.5,PG,92,"The spirits of a deceased couple are harassed by an unbearable family that has moved into their home, and hire a malicious spirit to drive them out.",15000000,74842346
0095159,A Fish Called Wanda,1988,7.5,R,108,"In London, four very different people team up on a jewel heist, then try to double-cross one another for the loot, complicated by their efforts to fool a very proper barrister.",7500000,62493712
0094947,Nevarna razmerja,1988,7.5,R,119,A scheming widow and her manipulative ex-lover make a bet regarding the corruption of a recently married woman.,14000000,34670720
0094608,Obtozena,1988,7.1,R,111,"After a young woman suffers a brutal gang rape in a bar one night, a prosecutor assists in bringing the perpetrators to justice, including the ones who encouraged and cheered on the attack.",13000000,32078318
0094747,Bird,1988,7.1,R,161,The troubled life and career of jazz musician Charlie &quot;Bird&quot; Parker.,9000000,2181474
0096463,Zeposleno dekle,1988,6.8,R,113,"When a secretary&apos;s idea is stolen by her boss, she seizes an opportunity to steal it back by pretending she has her boss&apos; job.",28000000,102953112
0095638,The Milagro Beanfield War,1988,6.8,R,117,The accidental breakdown of an irrigation valve launches a hot confrontation between the mainly Latino farmers in a tiny New Mexico town and the real estate developers and politicians determined to acquire their land for a golf re...,22000000,13825794
0094606,The Accidental Tourist,1988,6.7,PG,121,An emotionally distant writer of travel guides must carry on with his life after his son is killed and his marriage crumbles.,,32632093
0097576,Indiana Jones in Zadnji križarski pohod,1989,8.2,PG-13,127,"In 1938, after his father goes missing while pursuing the Holy Grail, Indiana Jones finds himself up against the Nazis again to stop them from obtaining its powers.",48000000,474171806
0097165,Drustvo mrtvih pesnikov,1989,8.1,PG,128,"Maverick teacher John Keating returns in 1959 to the prestigious New England boys&apos; boarding school where he was once a star student, using poetry to embolden his pupils to new heights of self-expression.",16400000,235860116
0097099,Common Threads: Stories from the Quilt,1989,8.1,,79,A collection of profiles of people dead from AIDS who are remembered in the AIDS Memorial Quilt.,,
0097441,Bitka za slavo,1989,7.8,R,122,"Robert Gould Shaw leads the U.S. Civil War&apos;s first all-black volunteer company, fighting prejudices from both his own Union Army, and the Confederates.",18000000,26979166
0097937,Moja leva noga,1989,7.8,R,103,"Christy Brown, born with cerebral palsy, learns to paint and write with his only controllable limb - his left foot.",600000,14743391
0097757,Mala morska deklica,1989,7.6,G,83,A mermaid princess makes a Faustian bargain in an attempt to become human and win a prince&apos;s love.,40000000,211343479
0096754,Brezno,1989,7.5,PG-13,140,A civilian diving team is enlisted to search for a lost nuclear submarine and faces danger while encountering an alien aquatic species.,70000000,90520202
0096895,Batman,1989,7.5,PG-13,126,"The Dark Knight of Gotham City begins his war on crime with his first major enemy being Jack Napier, a criminal who becomes the clownishly homicidal Joker.",35000000,411569241
0097499,Henrik V,1989,7.5,PG-13,137,"In the midst of the Hundred Years War, the young King Henry V of England embarks on the conquest of France in 1415.",9000000,10161099
0097239,Šofer gospodične Daisy,1989,7.3,PG,99,An old Jewish woman and her African-American chauffeur in the American South have a relationship that grows and improves over the years.,7500000,145793296
0096969,Rojen četrtega julija,1989,7.2,R,145,"The biography of Ron Kovic. Paralyzed in the Vietnam war, he becomes an anti-war and pro-human rights political activist after feeling betrayed by the country for which he fought.",14000000,161001698
0099685,Dobri fantje,1990,8.7,R,145,"The story of Henry Hill and his life in the mafia, covering his relationship with his wife Karen and his mob partners Jimmy Conway and Tommy DeVito.",25000000,47049784
0099348,Plese z volkovi,1990,8.0,PG-13,181,"Lieutenant John Dunbar, assigned to a remote western Civil War outpost, finds himself engaging with a neighbouring Sioux settlement, causing him to question his own purpose.",22000000,424208848
0100157,Misery,1990,7.8,R,107,"After a famous author is rescued from a car crash by a fan of his novels, he comes to realize that the care he is receiving is only the beginning of a nightmare of captivity and abuse.",20000000,61277597
0099028,American Dream,1990,7.8,PG-13,98,Recounts the 1985-86 strike against the Hormel Foods Corporation in Minnesota after its employees&apos; wages and benefits were cut.,,269823
0100802,Total Recall,1990,7.5,R,113,"When a man goes in to have virtual vacation memories of the planet Mars implanted in his mind, an unexpected and harrowing series of events forces him to go to the planet for real - or is he?",65000000,261317921
0099810,Lov na rdeči oktober,1990,7.5,PG,135,"In November 1984, the Soviet Union&apos;s best submarine captain violates orders and heads for the U.S. in a new undetectable sub. The American CIA and military must quickly determine: Is he trying to defect or to start a war?",30000000,200512643
0099334,Cyrano de Bergerac,1990,7.5,PG,137,"Famed swordsman and poet Cyrano de Bergerac is in love with his cousin Roxane. He has never expressed his love for her as he his large nose undermines his self-confidence. Then he finds a way to express his love to her, indirectly.",,5822041
0100470,Reise der Hoffnung,1990,7.5,PG,105,The story of a poor Turkish family who try to emigrate illegally to Switzerland.,,261718
0100486,Reversal of Fortune,1990,7.2,R,111,"Wealthy Sunny von Bülow lies brain-dead, husband Claus guilty of attempted murder; but he says he&apos;s innocent and hires Alan Dershowitz for his appeal.",,15445131
0099653,Duh,1990,7.1,PG-13,127,"After a young man is murdered, his spirit stays behind to warn his lover of impending danger, with the help of a reluctant psychic.",22000000,505703557
0099422,Dick Tracy,1990,6.2,PG,105,The comic strip detective finds his life vastly complicated when Breathless Mahoney makes advances towards him while he is trying to battle Big Boy Caprice&apos;s united mob.,47000000,162738726
0102926,Ko jagenjčki obmolknejo,1991,8.6,R,118,"A young F.B.I. cadet must receive the help of an incarcerated and manipulative cannibal killer to help catch another serial killer, a madman who skins his victims.",19000000,272742922
0103064,Terminator 2 - Sodni dan,1991,8.6,R,137,"A cyborg, identical to the one who failed to kill Sarah Connor, must now protect her ten year old son John from an even more advanced and powerful cyborg.",102000000,520881154
0101414,Lepotica in zver,1991,8.0,G,84,A prince cursed to spend his days as a hideous monster sets out to regain his humanity by earning a young woman&apos;s love.,25000000,424967620
0102138,J.F.K.,1991,8.0,R,189,New Orleans District Attorney Jim Garrison discovers there&apos;s more to the Kennedy assassination than the official story.,40000000,205405498
0103074,Thelma in Louise,1991,7.6,R,130,"Two best friends set out on an adventure, but it soon turns around to a terrifying escape from being hunted by the police, as these two women escape for the crimes they committed.",16500000,45472705
0101889,Kraljevi ribic,1991,7.5,R,137,"A former radio DJ, suicidally despondent because of a terrible mistake he made, finds redemption in helping a deranged homeless man who was an unwitting victim of that mistake.",24000000,41895491
0102426,Mediterraneo,1991,7.4,R,96,"In WW2, an Italian Army unit of misfits occupies an isolated non-strategic Greek island for the duration of the war.",,4532791
0101587,Mestni fantje,1991,6.8,PG-13,113,"On the verge of turning 40, an unhappy Manhattan yuppie is roped into joining his two friends on a cattle drive in the southwest.",27000000,179033791
0101516,Bugsy,1991,6.8,R,136,The story of how Benjamin &quot;Bugsy&quot; Siegel started Las Vegas.,30000000,49114016
0102114,In the Shadow of the Stars,1991,6.5,Not Rated,93,"Winner of the Academy Award for Best Documentary Feature, this film is a hilarious and affectionate look at the path to stardom inside the competitive world of opera.",,
0105695,Neoproščeno,1992,8.2,R,130,"Retired Old West gunslinger William Munny reluctantly takes on one last job, with the help of his old partner Ned Logan and a young man, The &quot;Schofield Kid.&quot;",14400000,159167799
0103639,Aladin,1992,8.0,G,90,A kind-hearted street urchin and a power-hungry Grand Vizier vie for a magic lamp that has the power to make their deepest wishes come true.,28000000,504050219
0105323,Vonj po ženski,1992,8.0,R,156,"A prep school student needing money agrees to &quot;babysit&quot; a blind man, but the job is not at all what he anticipated.",31000000,134095253
0104691,Poslednji Mohikanec,1992,7.7,R,112,Three trappers protect the daughters of a British Colonel in the midst of the French and Indian War.,40000000,75506530
0104952,Moj bratranec Vinny,1992,7.6,R,120,"Two New Yorkers accused of murder in rural Alabama while on their way back to college call in the help of one of their cousins, a loudmouth lawyer with no trial experience.",11000000,64088552
0105089,The Panama Deception,1992,7.5,,91,A film about the true reasons for the 1989 US invasion of Panama and big media complicity in these activities.,,309596
0103874,Drakula,1992,7.4,R,128,The centuries old vampire Count Dracula comes to England to seduce his barrister Jonathan Harker&apos;s fiancée Mina Murray and inflict havoc in the foreign land.,40000000,215862692
0104454,Howards End,1992,7.4,PG,142,"Set in the early 20th century, class distinctions and troubled relations affect the relationship between two families and the ownership of a cherished British estate known as Howards End.",,26343187
0105265,Reka poje mi,1992,7.2,PG,123,"Two sons of a stern minister - one reserved, one rebellious - grow up in rural 1920s Montana while devoted to fly fishing.",12000000,43440294
0104036,Igra solz,1992,7.2,R,112,"A British soldier kidnapped by the IRA soon befriends one of his captors, who then becomes drawn into the soldier&apos;s world.",2300000,62548947
0103791,Zlati casi,1992,7.1,R,109,A 1931 Spanish military deserter finds himself on a lonely farm until the farmer&apos;s four daughters pay a visit and he falls for all of them.,,5418502
0104507,Indochine,1992,7.0,PG-13,160,"Eliane adopts Camille, whose Vietnamese parents were friends. In 1930, a French navy officer is interested in Eliane (owns 60km2 plantation) and later in Camille. There&apos;s an uprising in Vietnam against French colonial power.",,5603158
0104070,Smrt ji lepo pristoji,1992,6.6,PG-13,104,"When a fading actress learns of an immortality treatment, she sees it as a way to outdo her long-time rival.",55000000,149022650
0108052,Schindlerjev seznam,1993,9.0,R,195,"In German-occupied Poland during World War II, industrialist Oskar Schindler gradually becomes concerned for his Jewish workforce after witnessing their persecution by the Nazis.",22000000,322161245
0107290,Jurski park,1993,8.2,PG-13,127,A pragmatic paleontologist touring an almost complete theme park on an island in Central America is tasked with protecting a couple of kids after a power failure causes the park&apos;s cloned dinosaurs to run loose.,63000000,1114456337
0106977,Ubežnik,1993,7.8,PG-13,130,"Dr. Richard Kimble, unjustly accused of murdering his wife, must find the real killer while being the target of a nationwide manhunt led by a seasoned U.S. Marshal.",44000000,368875760
0107818,Filadelfija,1993,7.7,PG-13,125,"When a man with HIV is fired by his law firm because of his condition, he hires a homophobic-small time lawyer as the only willing advocate for a wrongful dismissal suit.",26000000,206678440
0107822,Klavir,1993,7.5,R,121,"In the mid-19th century a mute woman is sent to New Zealand along with her young daughter and prized piano for an arranged marriage to a farmer, but is soon lusted after by a farm worker.",7000000,40185556
0106226,Cas nedolznosti,1993,7.2,PG,139,"A tale of nineteenth-century New York high society in which a young lawyer falls in love with a woman separated from her husband, while he is engaged to the woman&apos;s cousin.",34000000,32255953
0107614,Gospa Doubtfire - Očka v krilu,1993,7.1,PG-13,125,"After a bitter divorce, an actor disguises himself as a female housekeeper to spend time with his children held in custody by his former wife.",25000000,441286195
0107177,I Am a Promise: The Children of Stanton Elementary School,1993,7.1,,89,Filmmakers Alan Raymond and Susan Raymond document Philadelphia teachers facing challenges at an inner-city school.,,
0110912,Šund,1994,8.9,R,154,"The lives of two mob hitmen, a boxer, a gangster and his wife, and a pair of diner bandits intertwine in four tales of violence and redemption.",8000000,213928762
0109830,Forrest Gump,1994,8.8,PG-13,142,"The history of the United States from the 1950s to the &apos;70s unfolds from the perspective of an Alabama man with an IQ of 75, who yearns to be reunited with his childhood sweetheart.",55000000,678226465
0110357,The Lion King,1994,8.5,G,88,"Lion prince Simba and his father are targeted by his bitter uncle, who wants to ascend the throne himself.",45000000,968750694
0109707,Ed Wood,1994,7.8,R,127,Ambitious but troubled movie director Edward D. Wood Jr. tries his best to fulfill his dreams despite his lack of talent.,18000000,5887725
0110877,Postar,1994,7.8,PG,108,"A simple Italian postman learns to love poetry while delivering mail to a famous poet, and then uses this to woo local beauty Beatrice.",3000000,21898920
0111579,Utomlennye solntsem,1994,7.8,R,135,"In the USSR in 1936, shadows of Stalin&apos;s repressions fall on a famous, revolutionary hero. The accusations of him being a foreign spy are nonsense, and everyone knows that. However, a slow process of his downfall has already started.",2800000,2313461
0110322,Jesenska pripoved,1994,7.5,R,133,"In the early 1900s, three brothers and their father living in the remote wilderness of Montana are affected by betrayal, history, love, nature, and war.",30000000,160638883
0109045,"Priscilla, kraljica puscave",1994,7.5,R,104,Two drag performers and a transgender woman travel across the desert to perform their unique style of cabaret.,,11270701
0109348,Krogle nad Broadwayjem,1994,7.4,R,98,"In New York in 1928, a struggling playwright is forced to cast a mobster&apos;s talentless girlfriend in his latest drama in order to get it produced.",20000000,13383747
0111257,Hitrost,1994,7.3,R,116,A young police officer must prevent a bomb exploding aboard a city bus by keeping its speed above 50 mph.,30000000,350448145
0110480,Maya Lin: A Strong Clear Vision,1994,7.3,,105,A film about the work of the artist most famous for her monuments such as the Vietnam Memorial Wall and the Civil Rights Fountain Memorial.,,62186
0110428,The Madness of King George,1994,7.2,PG-13,110,"When King George III goes mad, his Lieutenants try to adjust the rules to run the country without his participation.",65897768,15238689
0109306,Blue Sky,1994,6.4,PG-13,101,"Carly moves with her military husband and their two daughters to an isolated army base, only to quickly become part of a cover-up involving nuclear bomb tests.",16000000,3359465
0114814,Osumljenih pet,1995,8.5,R,106,The sole survivor of a pier shoot-out tells the story of how a notorious criminal influenced the events that began with five criminals meeting in a seemingly random police lineup.,6000000,23341568
0112573,Pogumno srce,1995,8.3,R,178,Scottish warrior William Wallace leads his countrymen in a rebellion to free his homeland from the tyranny of King Edward I of England.,72000000,213216216
0114709,Svet igrač,1995,8.3,G,81,A cowboy doll is profoundly threatened and jealous when a new spaceman action figure supplants him as top toy in a boy&apos;s bedroom.,30000000,394436586
0112373,Anne Frank Remembered,1995,8.1,PG,117,"Tells the story of the Frank family and paints a portrait of their brash and free-spirited daughter Anne, perhaps the world&apos;s most famous victim of the Holocaust.",,1310200
0112384,Apollo 13,1995,7.7,PG,140,NASA must devise a strategy to return Apollo 13 to Earth safely after the spacecraft undergoes massive internal damage putting the lives of the three astronauts on board in jeopardy.,52000000,355237933
0114388,Razsodnost in rahlocutnost,1995,7.7,PG,136,"Rich Mr. Dashwood dies, leaving his second wife and her three daughters poor by the rules of inheritance. The two eldest daughters are the title opposites.",16000000,134582776
0113627,Zbogom Las Vegas,1995,7.5,R,111,"Ben Sanderson, a Hollywood screenwriter who lost everything because of his alcoholism, arrives in Las Vegas to drink himself to death. There, he meets and forms an uneasy friendship and non-interference pact with prostitute Sera.",3600000,32029928
0112818,Zadnji sprehod,1995,7.5,R,122,"A nun, while comforting a convicted killer on death row, empathizes with both the killer and his victim&apos;s families.",11000000,39363635
0112379,Antonia,1995,7.4,R,102,"A Dutch matron establishes and, for several generations, oversees a close-knit, matriarchal community where feminism and liberalism thrive.",1500000,4249321
0113819,Mogočna Afrodita,1995,7.0,R,95,"When he discovers his adopted son is a genius, a New York sportswriter seeks out the boy&apos;s birth mother: a ditzy porn star and prostitute.",15000000,6468498
0112431,Pujsek Babe,1995,6.9,G,91,"Gentle farmer Arthur Hoggett wins a piglet Babe at a county fair. Narrowly escaping his fate as Christmas dinner, Babe bonds with motherly border collie Fly and discovers that he too can herd sheep. But will the other animals acce...",30000000,254134910
0114148,Pocahontas,1995,6.7,G,81,An English soldier and the daughter of an Algonquin chief share a romance when English colonists invade seventeenth century Virginia.,55000000,346079773
