id,naslov,leto,ocena,oznaka,cas,opis,cena,zasluzek
0068924,Marjoe,1972,7.4,PG,88,"This Oscar-winning documentary explores the life of one-time child evangelist and faith healer Marjoe Gortner. The son of professional evangelists, Gortner was preaching on the Southern tent-revival circuit by the age of 3.",,
0068326,Butterflies Are Free,1972,7.2,PG,109,A blind man moves into his own apartment against the wishes of his overprotective mother and befriends the freethinking young woman next door.,,
0069113,The Poseidon Adventure,1972,7.1,PG,117,A group of passengers must embark on a harrowing struggle for survival after a rogue wave capsizes their cruise ship at sea.,5000000,84563118
0068334,Politicna kuhinja,1972,7.0,PG,110,"Bill McKay is a candidate for the U.S. Senate from California. He has no hope of winning, so he is willing to tweak the establishment.",1500000,
0069404,Potovanja z mojo teto,1972,6.3,PG,108,"At his mother&apos;s funeral, banker Henry meets his Aunt Augusta, an eccentric old woman who takes him on a wild adventure to rescue an old lover.",3200000,
0070735,Želo,1973,8.3,PG,129,Two grifters team up to pull off the ultimate con.,5500000,156000000
0070047,The Exorcist,1973,8.1,R,122,"When a young girl is possessed by a mysterious entity, her mother seeks the help of two Catholic priests to save her life.",11000000,441306145
0070510,Papirnati mesec,1973,8.1,PG,102,"During the Great Depression, a con man finds himself saddled with a young girl who may or may not be his daughter, and the two forge an unlikely partnership.",2500000,591
0070460,Ameriška noč,1973,8.0,PG,116,"A committed film director struggles to complete his movie while coping with a myriad of crises, personal and professional, among the cast and crew.",,509
0071129,Amarcord,1973,7.8,R,123,A series of comedic and nostalgic vignettes set in a 1930s Italian coastal town.,,197754
0070509,The Paper Chase,1973,7.2,PG,113,"A first-year law student at Harvard Law School struggles with balancing his coursework and a woman, unaware that she has a connection that affects their relationship.",,
0070903,The Way We Were,1973,7.0,PG,118,"During post-WWII McCarthyism, a diametrically opposed couple come together only to find out that genuine friendship and physical attraction is not enough to overcome fundamental societal beliefs.",5000000,45000493
0070640,Rešite tigra,1973,6.9,R,100,A disillusioned war veteran has two days to let go of his shaken morals if he wants his small fashion company to survive.,1000000,
0070819,A Touch of Class,1973,6.5,PG,106,Romantic comedy about a pair of clandestine lovers in a London-Spain tryst.,,
0071562,"Boter, II. del",1974,9.0,R,202,"The early life and career of Vito Corleone in 1920s New York City is portrayed, while his son, Michael, expands and tightens his grip on the family crime syndicate.",13000000,47962897
0071604,Hearts and Minds,1974,8.2,R,112,A startling and courageous landmark documentary that unflinchingly confronted the United States&apos; involvement in Vietnam at the height of the controversy that surrounded it.,,28754
0071315,Kitajska četrt,1974,8.1,R,130,"A private detective hired to expose an adulterer in 1930s Los Angeles finds himself caught up in a web of deceit, corruption, and murder.",6000000,29229859
0071598,Clovek in macek,1974,7.3,R,115,"When his apartment building is torn down, a retired lifelong New Yorker goes on a cross-country odyssey with his beloved cat Tonto.",980000,
0071115,Alice ne zivi vec tukaj,1974,7.3,PG,112,"A recently widowed woman is on the road with her precocious young son, determined to make a new life for herself as a singer.",1800000,18600211
0071877,Murder on the Orient Express,1974,7.2,PG,128,"In December 1935, when his transcontinental luxury train is stranded by deep snow, detective Hercule Poirot is called on to solve a murder that occurred in his car the night before, with a multitude of suspects.",1500000,27659517
0072308,The Towering Inferno,1974,7.0,PG,165,"At the opening party of a colossal, but poorly constructed, office building, a massive fire breaks out that threatens to destroy the tower and everyone in it.",14000000,116000429
0070135,The Great American Cowboy,1974,6.7,G,89,"A documentary about the rivalry between veteran Larry Mahan and newcomer Phil Lyne, as the two vie for the National Finals Rodeo Championship title.",,
0071577,The Great Gatsby,1974,6.4,PG,144,"A Midwesterner becomes fascinated with his nouveau riche neighbor, who obsesses over his lost love.",6500000,20563766
0071455,Earthquake,1974,5.9,PG,122,"Various interconnected people struggle to survive when an earthquake of unimaginable magnitude hits Los Angeles, California.",7000000,79666653
0073486,Let nad kukavičjim gnezdom,1975,8.7,R,133,"In the Fall of 1963, a Korean War veteran and criminal pleads insanity and is admitted to a mental institution, where he rallies up the scared patients against the tyrannical nurse.",3000000,109115366
0071411,Dersu Uzala,1975,8.2,G,142,The Russian army sends an explorer on an expedition to the snowy Siberian wilderness where he makes friends with a seasoned local hunter.,4000000,14480
0073195,Žrelo,1975,8.1,PG,124,"When a killer shark unleashes chaos on a beach community off Cape Cod, it&apos;s up to a local sheriff, a marine biologist, and an old seafarer to hunt the beast down.",7000000,477220580
0072684,Barry Lyndon,1975,8.1,PG,185,An Irish rogue wins the heart of a rich widow and assumes her dead husband&apos;s aristocratic position in 18th-century England.,11000000,260131
0072890,Pasje popoldne,1975,8.0,R,125,"Three amateur bank robbers plan to hold up a bank. A nice simple robbery: Walk in, take the money, and run. Unfortunately, the supposedly uncomplicated heist suddenly becomes a bizarre nightmare as everything that could go wrong d...",1800000,50001496
0073440,Nashville,1975,7.6,R,160,"Over the course of a few hectic days, numerous interrelated people prepare for a political convention.",2200000,9993529
0073340,The Man Who Skied Down Everest,1975,7.2,G,85,This Oscar-winning documentary tells the story behind Japanese daredevil Yuichiro Miura&apos;s 1970 effort to ski down the world&apos;s tallest mountain.,410000,
0073766,The Sunshine Boys,1975,7.1,PG,111,"A vaudeville duo agree to reunite for a television special, but it turns out that they can&apos;t stand each other.",,
0073692,Šampon,1975,6.4,R,110,"On Election Day, 1968, a hairdresser and ladies&apos; man is too busy cutting hair and dealing with his various girlfriends and his mistress, whose husband he meets and finds out is having an affair with his ex-girlfriend.",4000000,49407734
0073113,The Hindenburg,1975,6.2,PG,125,A chronicle of the Hindenburg disaster in which a zeppelin burst into flames.,15000000,
0074605,Harlan County U.S.A.,1976,8.2,PG,103,A heartbreaking record of the thirteen-month struggle between a community fighting to survive and a corporation dedicated to the bottom line.,,
0075148,Rocky,1976,8.1,PG,120,A small-time Philadelphia boxer gets a supremely rare chance to fight the world heavyweight champion in a bout in which he strives to go the distance for his self-respect.,960000,117251948
0074958,Televizijska mreža,1976,8.1,R,121,"A television network cynically exploits a deranged former anchor&apos;s ravings and revelations about the news media for its own profit, but finds that his message may be difficult to control.",3800000,23692346
0074119,Vsi predsednikovi možje,1976,7.9,PG,138,&quot;The Washington Post&quot; reporters Bob Woodward and Carl Bernstein uncover the details of the Watergate scandal that leads to President Richard Nixon&apos;s resignation.,8500000,70600414
0075005,The Omen,1976,7.5,R,111,Mysterious deaths surround an American ambassador. Could the child that he is raising actually be the Antichrist? The Devil&apos;s own son?,2800000,60922980
0074235,Zapisan slavi,1976,7.2,PG,147,The early life of Woody Guthrie as a vagabond folk singer.,,
0074291,Il Casanova di Federico Fellini,1976,7.0,R,155,Giacomo Casanova uses his sexuality to find his place in life amid eccentric and strange characters.,,227
0074812,Loganov pobeg,1976,6.8,PG,119,A police officer in the future uncovers the deadly secret behind a society that worships youth.,9000000,
0074972,La victoire en chantant,1976,6.7,PG,90,"During World War I, French colonists lost in African desert decide to attack their German neighbors.",,
0075265,Zvezda je rojena,1976,6.1,R,139,"A has-been rock star falls in love with a young, up-and-coming songstress.",6000000,80000000
0074751,King Kong,1976,6.0,PG,134,A petroleum exploration expedition comes to an isolated island and encounters a colossal giant gorilla.,24000000,52614445
0076759,Vojna zvezd: Epizoda IV - Novo upanje,1977,8.6,PG,121,"Luke Skywalker joins forces with a Jedi Knight, a cocky pilot, a Wookiee and two droids to save the galaxy from the Empire&apos;s world-destroying battle station, while also attempting to rescue Princess Leia from the mysterious Darth ...",11000000,775398507
0075686,Annie Hall,1977,8.0,PG,93,"Alvy Singer, a divorced Jewish comedian, reflects on his relationship with ex-lover Annie Hall, an aspiring nightclub singer, which ended abruptly just like his previous marriages.",4000000,38289445
0075860,Bližnja srečanja tretje vrste,1977,7.6,PG,138,"Roy Neary, an Indiana electric lineman, finds his quiet and ordinary daily life turned upside down after a close encounter with a UFO, spurring him to an obsessed cross-country quest for answers as a momentous event approaches.",20000000,306889114
0076095,The Goodbye Girl,1977,7.4,PG,111,"After being dumped by her live-in boyfriend, an unemployed dancer and her 10-year-old daughter are reluctantly forced to live with a struggling off-Broadway actor.",,
0076348,La vie devant soi,1977,7.2,PG,105,"Madame Rosa, an ex-prostitute of Jewish origin, lives in a dilapidated old building in Belleville. Tired and worn out by life, she looks after young children, placed in her care by the social welfare people.",,
0076918,Who Are the DeBolts? and Where Did They Get Nineteen Kids?,1977,7.2,Not Rated,72,"Dorothy and Bob DeBolt&apos;s tale of the struggles and joys involved in their 19 adopted children, many of who are physically disabled war orphans.",,
0076245,Julia,1977,7.1,PG,117,"At the behest of an old and dear friend, playwright Lillian Hellman undertakes a dangerous mission to smuggle funds into Nazi Germany.",7840000,20714400
0076319,A Little Night Music,1977,5.4,PG,124,"An actress, her married ex-lover, her current lover&apos;s wife and other guests gather at a circa-1900 estate.",,
0076941,You Light Up My Life,1977,4.7,PG,90,"Laurie has been in show business since she was a child. Her dream is to be a singer, songwriter and actress. Her father wants her to be a comedian like him and Laurie only tries because it pleases her father. But she is a lousy co...",,
0077416,Lovec na jelene,1978,8.1,R,183,An in-depth examination of the ways in which the Vietnam War impacts and disrupts the lives of several friends in a small steel mill town in Pennsylvania.,15000000,49080126
0077405,Božanski dnevi,1978,7.7,PG,94,A hot-tempered farm laborer convinces the woman he loves to marry their rich but dying boss so that they can have a claim to his fortune.,3000000,3487008
0078205,Scared Straight!,1978,7.7,TV-PG,96,The filmed depiction of a program where convicts tell troubled kids about the horrors of prison life.,,
0077928,Polnočni ekspres,1978,7.5,R,121,"Billy Hayes, an American college student, is caught smuggling drugs out of Turkey and thrown into prison.",2300000,35000000
0078346,Superman,1978,7.4,PG,143,"An alien orphan is sent from his dying planet to Earth, where he grows up to become his adoptive home&apos;s first and greatest superhero.",55000000,300478449
0077362,Vojakova vrnitev,1978,7.3,R,127,"In 1968 California, a woman whose husband is a Marine officer fighting in Vietnam falls in love with a former high school classmate who suffered a paralyzing combat injury in the war.",3000000,32653905
0077413,Death on the Nile,1978,7.2,PG,140,"As Hercule Poirot enjoys a luxurious cruise down the Nile, a newlywed heiress is found murdered on board. Can Poirot identify the killer before the ship reaches the end of its journey?",7920000,14569266
0077280,The Buddy Holly Story,1978,7.2,PG,114,"The story of the life and career of the early rock and roll singer, from his meteoric rise to stardom, to his marriage and untimely death.",1200000,14363400
0078122,Pripravite robcke,1978,7.0,R,108,"A worried husband finds a lover for his depressed wife, but she falls in love with a bullied thirteen-year-old math prodigy and wants to have the boy&apos;s baby.",,
0077663,Heaven Can Wait,1978,6.9,PG,101,"A Los Angeles Rams quarterback, accidentally taken away from his body by an overanxious angel before he was meant to die, returns to life in the body of a recently murdered millionaire.",6000000,81640278
0077289,California Suite,1978,6.2,PG,103,Misadventures of four groups of guests at the Beverly Hills Hotel.,,
0078382,"Hvala bogu, danes je petek",1978,5.4,PG,89,"A Friday in the life of the disco club The Zoo, where the staff and clients meet and dance their lives away.",2200000,
0078748,Osmi potnik,1979,8.5,R,117,The crew of a commercial spacecraft encounters a deadly lifeform after investigating a mysterious transmission of unknown origin.,11000000,108591169
0078788,Apokalipsa danes,1979,8.4,R,147,A U.S. Army officer serving in Vietnam is tasked with assassinating a renegade Special Forces Colonel who sees himself as a god.,31500000,104920499
0078841,"Dobrodosli, gospod Chance",1979,7.9,PG,130,"After the death of his employer forces him out of the only home he&apos;s ever known, a simpleminded, sheltered gardener becomes an unlikely trusted advisor to a powerful tycoon and an insider in Washington politics.",,30177663
0079417,Kramer proti Kramerju,1979,7.8,PG,105,"After his wife leaves him, a work-obsessed Manhattan advertising executive is forced to learn long-neglected parenting skills, but a heated custody battle over the couple&apos;s young son deepens the wounds left by the separation.",8000000,106260000
0078754,Ves ta jazz,1979,7.8,R,123,"Director/choreographer Bob Fosse tells his own life story as he details the sordid career of Joe Gideon, a womanizing, drug-using dancer.",12000000,37824824
0078850,Best Boy,1979,7.8,,111,"In this documentary, the director follows the day-to-day activities of his mentally ill, middle-aged cousin Philly, over a three-year period.",,
0078902,Štirje gadi,1979,7.7,PG,101,A working-class Indiana teen obsessed with the Italian cycling team vies for the affections of a college girl while searching for life goals with his friends.,2300000,16424918
0078875,Die Blechtrommel,1979,7.5,R,142,"In 1924, Oskar Matzerath is born in the Free City of Danzig. At age three, he falls down a flight of stairs and stops growing. In 1939, World War II breaks out.",,7159
0080762,From Mao to Mozart: Isaac Stern in China,1979,7.5,G,84,"Isaac Stern&apos;s cultural tour of China is seen, with the master violinist performing and mentoring young Chinese musicians. He visits rehearsals of the Peking Opera, meeting with their musicians who use traditional Chinese instrumen...",,1205934
0078872,The Black Stallion,1979,7.4,G,118,"After being shipwrecked with a magnificent horse off the coast of Africa in the 1940s, a boy bonds with the stallion, and trains him to race after their rescue.",2700000,37799643
0079477,A Little Romance,1979,7.4,PG,110,An American teenager living in Paris meets and falls in love with a local.,3000000,
0080009,Tess,1979,7.3,PG,186,A strong-willed young peasant girl attracts the affection of two men.,12000000,20101247
0079638,Norma Rae,1979,7.3,PG,114,A young single mother and textile worker agrees to help unionize her mill despite the problems and dangers involved.,,22228000
0080684,Star Wars: Episode V - The Empire Strikes Back,1980,8.7,PG,124,"After the Rebel Alliance are overpowered by the Empire, Luke Skywalker begins his Jedi training with Yoda, while his friends are pursued across the galaxy by Darth Vader and bounty hunter Boba Fett.",18000000,538375067
0081398,Pobesneli bik,1980,8.1,R,129,"The life of boxer Jake LaMotta, whose violence and temper that led him to the top in the ring destroyed his life outside of it.",18000000,23405198
0079579,Moskva slezam ne verit,1980,8.0,PG,150,"Three young provincial women come to Moscow in search of what people in all the capitals of the world are looking for - love, happiness and prosperity. Their destinies develop exactly as the character of each of the girls suggests.",900000,17023
0081283,Navadni ljudje,1980,7.7,R,124,"The accidental death of the older son of an affluent family deeply strains the relationships among the bitter mother, the good-natured father and the guilt-ridden younger son.",6000000,54766923
0080549,Coal Miner&#x27;s Daughter,1980,7.5,PG,124,"The fictionalized life of singer Loretta Lynn, a girl who rose from humble beginnings to become a country music star in the 1960s/70s.",,67182787
0081150,Melvin and Howard,1980,6.8,R,95,"The story of hard-luck Melvin E. Dummar, who claimed to have received a will naming him an heir to the fortune of Howard Hughes.",7000000,4309490
0080716,Fame,1980,6.6,R,134,A chronicle of the lives of several teenagers who attend a New York high school for students gifted in the performing arts.,,21203004
0082971,Lov za izgubljenim zakladom,1981,8.4,PG,115,"In 1936, archaeologist and adventurer Indiana Jones is hired by the U.S. government to find the Ark of the Covenant before the Nazis can obtain its awesome powers.",18000000,389925971
0082736,Mephisto,1981,7.7,Unrated,146,"In early-1930s Germany, a passionate stage actor faces a dilemma: renounce his apolitical stance and comply with the Reich&apos;s doctrine, or face oblivion. But, Faustian bargains never end well. What is the price of success?",,
0082846,Na zlatem ribniku,1981,7.6,PG,109,"Norman is a curmudgeon with an estranged relationship with his daughter Chelsea. At Golden Pond, he and his wife nevertheless agree to care for Billy, the son of Chelsea&apos;s new boyfriend, and a most unexpected relationship blooms.",7500000,119285810
0082010,An American Werewolf in London,1981,7.5,R,97,Two American college students on a walking tour of Britain are attacked by a werewolf that none of the locals will admit exists.,10000000,30800631
0082484,La guerre du feu,1981,7.3,R,100,This story takes place in prehistoric time when three tribesmen search for a new fire source.,12500000,20962615
0082979,Reds,1981,7.3,PG,195,"A radical American journalist becomes involved with the Communist revolution in Russia, and hopes to bring its spirit and idealism to the United States.",32000000,40382788
0082158,Ognjene kocije,1981,7.1,PG,125,"Two British track athletes, one a determined Jew and the other a devout Christian, are driven to win in the 1924 Olympics as they wrestle with issues of pride and conscience.",5500000,59303767
0082031,Arthur,1981,6.9,PG,97,"Alcoholic billionaire playboy Arthur Bach must marry a woman he does not love, or he will be cut off from his $750,000,000 fortune. But when Arthur falls in love with a poor waitress, he must decide if he wants to choose love or m...",7000000,95461682
0083922,Fanny in Alexander,1982,8.1,R,188,"Two young Swedish children in the 1900s experience the many comedies and tragedies of their lively and affectionate theatrical family, the Ekdahls.",6000000,6799714
0083987,Gandhi,1982,8.0,PG,191,The life of the lawyer who became the famed leader of the Indian revolts against the British rule through his philosophy of nonviolent protest.,22000000,52767889
0083866,E. T. - Vesoljček,1982,7.9,PG,115,A troubled child summons the courage to help a friendly alien escape from Earth and return to his home planet.,10500000,792910554
0084335,Missing,1982,7.7,PG,122,"When an idealistic American writer disappears during the Chilean coup d&apos;état in September 1973, his wife and father try to find him.",9500000,14000000
0084865,Victor/Victoria,1982,7.6,PG,134,"A struggling female soprano in 1934 Paris finally finds work after posing as a female impersonator, but it complicates her personal life when a visiting Chicago gangster finds himself inexplicably attracted to the seemingly male p...",,28229046
0084707,Sophijina odlocitev,1982,7.5,R,150,"Sophie is the survivor of Nazi concentration camps, who has found a reason to live with Nathan, a sparkling if unsteady American Jew obsessed with the Holocaust.",12000000,30036166
0084805,Tootsie,1982,7.4,PG,116,"Michael Dorsey, an unsuccessful actor, disguises himself as a woman in order to get a role on a trashy hospital soap.",21000000,177200271
0082443,Genocide,1982,7.3,PG,90,"Orson Welles and Elizabeth Taylor compassionately narrate this harrowing documentary about Jewish persecution in Nazi Germany, which soon turned into a notoriously industrious plan to wipe them from existence.",3000000,
0084434,Castnik in gentelman,1982,7.1,R,124,"A young man must complete his work at a Navy Officer Candidate School to become an aviator, with the help of a tough Gunnery Sergeant and his new girlfriend.",7500000,129795890
0086617,The Year of Living Dangerously,1982,7.1,PG,115,A young Australian reporter tries to navigate the political turmoil of Indonesia during the rule of President Sukarno with the help of a diminutive photographer.,13000000,10278575
0084874,Volver a empezar,1982,6.9,PG,87,"A renowned Spanish writer returns to his natal city after 40 years and embarks on a journey back to his roots, triggering memories of his past.",40000000,
0086190,Vojna zvezd: Epizoda VI - Vrnitev jedija,1983,8.3,PG,131,"After rescuing Han Solo from Jabba the Hutt, the Rebel Alliance attempt to destroy the second Death Star, while Luke struggles to help Darth Vader back from the dark side.",32500000,475106177
0086197,The Right Stuff,1983,7.8,PG,193,"The U.S. space program&apos;s development from the breaking of the sound barrier to selection of the Mercury 7 astronauts, from a group of test pilots with a more seat-of-the-pants approach than the program&apos;s more cautious engineers pr...",27000000,21192315
0086425,Cas neznosti,1983,7.4,PG,132,Follows hard-to-please Aurora looking for love and her daughter&apos;s family problems.,8000000,108423749
0086423,Tender Mercies,1983,7.3,PG,92,"A broken-down, middle-aged country singer gets a new wife, reaches out to his long-lost daughter, and tries to put his troubled life back together.",,8443124
0086619,Yentl,1983,6.6,PG,133,A Jewish girl disguises herself as a boy to enter religious training.,12000000,40219251
0085549,Flashdance,1983,6.2,R,95,"An 18-year-old female amateur dancer who performs nightly at a dancing bar, and works as a welder during the day, dreams of joining the Pittsburgh ballet school.",7500000,92921203
0085655,He Makes Me Feel Like Dancin&#x27;,1983,6.2,,51,"Jacques d&apos;Amboise, a noted former American ballet star who had dancing roles in such films as Seven Brides for Seven Brothers (1954) and Carousel (1956), and who later became a New York dancing instructor.",,
0086879,Amadeus,1984,8.4,PG,160,"The life, success and troubles of Wolfgang Amadeus Mozart, as told by Antonio Salieri, the contemporaneous composer who was deeply jealous of Mozart&apos;s talent and claimed to have murdered him.",18000000,52071304
0088275,The Times of Harvey Milk,1984,8.2,Not Rated,90,A documentary of the successful career and assassination of San Francisco&apos;s first elected gay city supervisor.,,46573
0087553,Polja smrti,1984,7.8,R,141,"A journalist is trapped in Cambodia during tyrant Pol Pot&apos;s bloody &apos;Year Zero&apos; cleansing campaign, which claimed the lives of two million &apos;undesirable&apos; civilians.",14400000,34700291
0087469,Indiana Jones in tempelj smrti,1984,7.5,PG,118,"In 1935, Indiana Jones is tasked by Indian villagers with reclaiming a rock stolen from them by a secret cult beneath the catacombs of an ancient palace.",28000000,333107271
0087921,Places in the Heart,1984,7.4,PG,111,"In central Texas in the 1930s, a widow with two small children tries to save her small 40-acre farm with the help of a blind boarder and an itinerant black handyman.",,34901614
0087892,A Passage to India,1984,7.3,PG,164,"Cultural mistrust and false accusations doom a friendship in British colonial India between an Indian doctor, an Englishwoman engaged to marry a city magistrate, and an English educator.",16000000,27201487
0087144,La diagonale du fou,1984,6.6,,110,"During the Cold War, the World Chess Championship clashed complete opposites - personal and political.",,2500000
0087957,Purple Rain,1984,6.5,R,111,"A young musician, tormented by an abusive situation at home, must contend with a rival singer, a burgeoning romance, and his own dissatisfied band, as his star begins to rise.",7000000,70264522
0088007,Reka,1984,6.3,PG-13,124,"A farming family battles severe storms, while taking a valiant stand against a bank foreclosure and a powerful land grabber.",18000000,11489982
0088414,The Woman in Red,1984,5.9,PG-13,87,"On his way to work, Teddy spots Charlotte, an incredibly beautiful Woman in Red. He really wants to meet her, but what would his wife say?",9000000,25349388
0088763,Vrnitev v prihodnost,1985,8.5,PG,116,"Marty McFly, a 17-year-old high school student, is accidentally sent 30 years into the past in a time-traveling DeLorean invented by his close friend, the maverick scientist Doc Brown.",19000000,384577472
0089881,Ran,1985,8.2,R,160,"In Medieval Japan, an elderly warlord retires, handing over his empire to his three sons. However, he vastly underestimates how the new-found power will corrupt them and cause them to turn on each other...and him.",11500000,4166319
