id,naslov,leto,ocena,oznaka,cas,opis,cena,zasluzek
0043014,Sunset Blvd.,1950,8.4,Approved,110,A screenwriter develops a dangerous relationship with a faded film star determined to make a triumphant return.,1752000,304474
0042192,Vse o Evi,1950,8.2,Approved,138,A seemingly timid but secretly ruthless ingénue insinuates herself into the lives of an aging Broadway star and her circle of theater friends.,1400000,152366
0042876,V gozdu,1950,8.2,Not Rated,88,"The rape of a bride and the murder of her samurai husband are recalled from the perspectives of a bandit, the bride, the samurai&apos;s ghost and a woodcutter.",250000,117668
0042546,Harvey,1950,7.9,Approved,104,"Due to his insistence that he has an invisible six foot-tall rabbit for a best friend, a whimsical middle-aged man is thought by his family to be insane - but he may be wiser than anyone knows.",,
0042650,Kon-Tiki,1950,7.9,Approved,77,A documentary about the Kon-Tiki expedition of the Norwegian explorer Thor Heyerdahl.,,
0042276,Born Yesterday,1950,7.5,Approved,103,"A tycoon hires a tutor to teach his lover proper etiquette, with unexpected results.",,12000000
0042367,Cyrano de Bergerac,1950,7.4,Approved,113,The charismatic swordsman-poet helps another woo the woman he loves.,400000,
0042832,Panic in the Streets,1950,7.2,Approved,96,A doctor and a policeman in New Orleans have only 48 hours to locate a killer infected with pneumonic plague.,1400000,
0042949,Seven Days to Noon,1950,7.0,Not Rated,94,"When a scientist threatens to detonate a powerful bomb in the heart of London, Scotland Yard has just seven days to find him before it is too late.",,
0042200,Annie Get Your Gun,1950,6.9,Approved,107,"The story of the great sharpshooter Annie Oakley, who rose to fame while dealing with her love/professional rival, Frank Butler.",3768785,
0042646,King Solomon&#x27;s Mines,1950,6.8,Approved,103,Adventurer Allan Quartermain leads an expedition into uncharted African territory in an attempt to locate an explorer who went missing during his search for the fabled diamond mines of King Solomon.,2258000,
0043050,The Titan: Story of Michelangelo,1950,6.5,Not Rated,70,"The life and works of the great artist Michelangelo Buonarroti are shown against the historical background of his time. It begins with his earliest artworks, and follows his life and career as he achieves lasting fame. The documen...",,
0042393,Destination Moon,1950,6.3,Approved,92,"&quot;Destination Moon&quot;, tells the tale of when Doctor Charles Cargraves and retired General Thayer approach Jim Barnes, the head of his own aviation construction firms to help build a rocket that will take them to the moon.",592000,
0044081,Tramvaj Pozelenje,1951,7.9,Approved,122,Disturbed Blanche DuBois moves in with her sister in New Orleans and is tormented by her brutish brother-in-law while her reality crumbles around her.,1800000,52780
0043924,A Place in the Sun,1951,7.7,Approved,122,A poor boy gets a job working for his rich uncle and ends up falling in love with two women.,2295304,
0043265,The African Queen,1951,7.7,PG,105,"In WWI East Africa, a gin-swilling Canadian riverboat captain is persuaded by a strait-laced English missionary to undertake a trip up a treacherous river and use his boat to attack a German gunship.",1000000,46305
0044829,The Lavender Hill Mob,1951,7.5,Approved,78,A meek bank clerk who oversees the shipment of bullion joins with an eccentric neighbor to steal gold bars and smuggle them out of the country as miniature Eiffel Towers.,,21395
0043278,Amerikanec v Parizu,1951,7.2,Approved,114,Three friends struggle to find work in Paris. Things become more complicated when two of them fall in love with the same woman.,2723903,274027
0044207,Ko trčijo svetovi,1951,6.6,G,83,"As a new star and planet hurtle toward a doomed Earth, a small group of survivalists frantically work to complete the rocket which will take them to their new home.",936000,
0043599,The Great Caruso,1951,6.5,Approved,109,"This film traces the life of tenor Enrico Caruso (1873-1921). He loves Musetta, in his home town of Naples, and then Dorothy, the daughter of one of the Metropolitan Opera&apos;s patrons. Caruso is unacceptable to both women&apos;s fathers:...",,
0043633,Here Comes the Groom,1951,6.3,Approved,113,"Foreign correspondent Pete Garvey has 5 days to win back his former fiancée, or he&apos;ll lose the orphans he adopted.",2117000,
0044706,Točno opoldne,1952,8.0,PG,85,"A town Marshal, despite the disagreements of his newlywed bride and the townspeople around him, must face a gang of deadly killers alone at &quot;high noon&quot; when the gang leader, an outlaw he &quot;sent up&quot; years ago, arrives on the noon tr...",730000,217
0044837,Odrske luči,1952,8.0,G,137,A fading comedian and a suicidally despondent ballet dancer must look to each other to find purpose and hope in their lives.,,9291
0043686,Jeux interdits,1952,8.0,Not Rated,86,"A young French girl orphaned in a German air attack is befriended by the son of a poor farmer, and together they try to come to terms with the realities of death.",,19889
0044391,The Bad and the Beautiful,1952,7.8,Approved,118,"An unscrupulous movie producer uses an actress, a director and a writer to achieve success.",1558000,2025
0045061,Mirni moz,1952,7.7,Approved,129,"A retired American boxer returns to the village of his birth in 1920s Ireland, where he falls for a spirited redhead whose brother is contemptuous of their union.",1750000,
0044509,"Come Back, Little Sheba",1952,7.5,Approved,99,"An emotionally remote recovering alcoholic and his dowdy, unambitious wife face a personal crisis when they take in an attractive lodger.",,
0045296,Viva Zapata!,1952,7.3,Approved,113,"The story of Mexican revolutionary Emiliano Zapata, who led a rebellion against the corrupt, oppressive dictatorship of President Porfirio Díaz in the early 20th century.",1800000,
0044926,Moulin Rouge,1952,7.0,Approved,119,Fictional account of French artist Henri de Toulouse-Lautrec.,1500000,3188
0044446,The Sound Barrier,1952,6.7,Approved,118,Fictionalized story of British aerospace engineers solving the problem of supersonic flight.,250000,
0045333,With a Song in My Heart,1952,6.7,Approved,117,A talented singer&apos;s musical career begins to soar.,,
0044672,The Greatest Show on Earth,1952,6.5,Approved,152,"The dramatic lives of trapeze artists, a clown, and an elephant trainer are told against a background of circus spectacle.",4000000,36000000
0045039,Plymouth Adventure,1952,6.2,Approved,105,"Trials and tribulations beset the one hundred odd settlers that journey to Virginia in 1620 including unexpectedly arriving in Plymouth, Massachusetts.",3185000,
0046250,Rimske pocitnice,1953,8.0,Approved,118,A bored and sheltered princess escapes her guardians and falls in love with an American newsman in Rome.,1500000,22556
0046359,Stalag 17,1953,8.0,Approved,120,"After two Americans are killed while escaping from a German P.O.W. camp in World War II, the barracks black marketeer, J.J. Sefton, is suspected of being an informer.",1661530,
0046303,Shane,1953,7.6,Approved,118,"A weary gunfighter in 1880s Wyoming begins to envision a quieter life after befriending a homestead family with a young son who idolizes him, but a smoldering range war forces him to act.",3100000,
0045793,Od tod do večnosti,1953,7.6,Approved,118,"At a U.S. Army base in 1941 Hawaii, a private is cruelly punished for not boxing on his unit&apos;s team, while his commanding officer&apos;s wife and top aide begin a tentative affair.",1650000,36416
0046008,The Living Desert,1953,7.4,Approved,69,"Although first glance reveals little more than stones and sand, the desert is alive. Witness moving rocks, spitting mud pots, gorgeous flowers and the never-ending battle for survival between creatures of every shape, size and des...",,
0046000,Lili,1953,7.3,Approved,81,An orphaned young woman becomes part of a puppet act and forms a relationship with the anti-social puppeteer.,1353000,
0045943,Julius Caesar,1953,7.2,Approved,120,The growing ambition of Julius Caesar is a source of major concern to his close friend Brutus. Cassius persuades him to participate in his plot to assassinate Caesar but they have both sorely underestimated Mark Antony.,2070000,10831
0045591,Calamity Jane,1953,7.2,Approved,101,"The story of Calamity Jane, her saloon, and her romance with Wild Bill Hickok.",,1968
0045935,Vrata pekla,1953,7.1,Not Rated,89,A samurai pursues a married lady-in-waiting.,,7375
0046006,The Kidnappers,1953,7.1,Approved,93,"A Scotsman, Jim MacKenzie, living on a primitive homestead in Nova Scotia, is raising his two grandsons, Harry and Davy, following the death of their father in the Boer War. His son&apos;s death has developed antagonism by MacKenzie to...",,
0046534,Planetarna bitka,1953,7.0,G,85,"A small town in California is attacked by Martians, beginning a worldwide invasion.",2000000,
0046435,Titanic,1953,7.0,Approved,98,"An unhappily married couple struggle to deal with their problems while on board the luxurious, ill-fated RMS Titanic.",1805000,
0046247,The Robe,1953,6.7,Approved,135,"In the Roman province of Judea during the 1st century, Roman tribune Marcellus Gallio is ordered to crucify Jesus of Nazareth but is tormented by his guilty conscience afterwards.",5000000,36010866
0045592,Call Me Madam,1953,6.7,Approved,114,Washington hostess Sally Adams becomes a Truman-era US ambassador to a European grand duchy.,,
0044009,The Sea Around Us,1953,6.1,Approved,62,Oscar-winning documentary based on Rachel L. Carson&apos;s pioneering study of ocean life chronicled in her award-winning and best-selling 1951 book of the same name.,,
0047296,Na pristaniški obali,1954,8.1,Approved,108,"An ex-prize fighter turned New Jersey longshoreman struggles to stand up to his corrupt union bosses, including his older brother, as he starts to connect with the grieving sister of one of the syndicate&apos;s victims.",910000,3350
0047528,Cesta,1954,8.0,Not Rated,108,"A care-free girl is sold to a traveling entertainer, consequently enduring physical and emotional pain along the way.",,41362
0047437,Sabrina,1954,7.6,Approved,113,"A playboy becomes interested in the daughter of his family&apos;s chauffeur, but it&apos;s his more serious brother who would be the better man for her.",2238813,1730
0047444,Miyamoto Musashi,1954,7.4,Not Rated,93,"Depicts the early life of the legendary warrior Musashi Miyamoto; his years as an aspiring warrior, an outlaw and finally a true samurai.",,
0047472,Seven Brides for Seven Brothers,1954,7.3,Approved,102,"When a backwoodsman in 1850s Oregon brings a wife home to his farm, his six brothers decide that they want to get married too.",2540000,14071
0047030,Zgodba o Glennu Millerju,1954,7.3,Approved,115,Biography of bandleader Glenn Miller from his beginnings to his death over the English Channel in December 1944.,,994
0046672,"20,000 Leagues Under the Sea",1954,7.2,G,127,"A ship sent to investigate a wave of mysterious sinkings encounters the advanced submarine, the Nautilus, commanded by Captain Nemo.",9000000,
0046874,The Country Girl,1954,7.2,Approved,104,"A director hires an alcoholic has-been and strikes up a stormy relationship with the actor&apos;s wife, who he believes is the cause of all the man&apos;s problems.",,
0047642,The Vanishing Prairie,1954,7.2,Approved,71,Story of the American prairie as it was when vast herds of bison and elk grazed there.,,
0048157,The Unconquered,1954,7.2,Approved,55,"This documentary chronicles the life of Helen Keller, who was struck by an illness as a young child that left her both blind and deaf. Aided by her devoted teacher, Anne Sullivan, Keller is able to develop ways to communicate and ...",,
0046754,The Barefoot Contessa,1954,6.9,Approved,128,"This is the life of a Hollywood movie star named Maria, as told by writer/director Harry Dawes, from being discovered in Madrid, Spain, until her funeral in Italy.",,17018
0046808,Broken Lance,1954,6.9,Approved,96,"The saga of the Devereaux rancher family, set in 1880&apos;s Arizona.",2000000,
0046806,The Bridges at Toko-Ri,1954,6.7,Approved,102,"Set during the Korean War, a Navy fighter pilot must come to terms with with his own ambivalence towards the war and the fear of having to bomb a set of highly defended bridges. The ending of this grim war drama is all tension.",,12556
0047086,The High and the Mighty,1954,6.6,Approved,147,"When a commercial airliner develops engine problems on a trans-Pacific flight and the pilot loses his nerve, it is up to the washed-up co-pilot Dan Roman to bring the plane in safely.",1470000,4334
0047580,Trije novcici v vodnjaku,1954,6.2,Approved,102,"Three American women working in Rome, Italy share a spacious apartment and the desire to find love and marriage. Each one experiences a few bumps in her journey to romance.",,
0048028,Vzhodno od raja,1955,7.8,PG,118,"Two brothers in 1910s California struggle to maintain their strict, Bible-toting father&apos;s favor as an old secret about their long-absent mother comes to light.",,25181
0048356,Marty,1955,7.7,Approved,90,A middle-aged butcher and a school teacher who have given up on the idea of love meet at a dance and fall for each other.,343000,
0048380,Mister Roberts,1955,7.6,Approved,123,"In the waning days of World War II, the cargo officer of a Navy supply ship chafes at its role far from the action in the Pacific&apos;s backwater areas, his frustration rising when its captain denies the crew liberty over petty irrita...",,
0048728,Ujeti tatu,1955,7.4,PG,106,A retired jewel thief sets out to prove his innocence after being suspected of returning to his former occupation.,2500000,6367
0048191,I&#x27;ll Cry Tomorrow,1955,7.2,Approved,117,"Susan Hayward stars as singer-actress Lillian Roth, whose rise to stardom was nearly destroyed by alcoholism.",2147000,
0048317,Love Me or Leave Me,1955,7.1,Approved,122,"A fictionalized account of the career of jazz singer Ruth Etting and her tempestuous marriage to gangster Marty Snyder, who helped propel her to stardom.",2760000,193
0048445,Oklahoma!,1955,7.0,G,145,"In Oklahoma, several farmers, cowboys and a traveling salesman compete for the romantic favors of various local ladies.",5000000,16133
0048491,Picnic,1955,7.0,PG,115,Emotions are ignited among the complacent townsfolk when a handsome drifter arrives in a small Kansas community on the morning of the Labor Day picnic.,,
0048563,The Rose Tattoo,1955,6.9,Approved,117,A Sicilian seamstress who idolizes her husband must deal with several family crises upon his sudden death.,,
0048210,Interrupted Melody,1955,6.7,Approved,106,"This movie chronicles Australian-born opera star Marjorie Lawrence&apos;s success, her battle with polio, and her eventual career comeback.",2367000,
0048316,Love Is a Many-Splendored Thing,1955,6.4,Approved,102,A widowed Chinese-English doctor falls in love with a married American correspondent in Hong Kong during China&apos;s Communist Revolution.,1780000,29341
0049833,Deset zapovedi,1956,7.9,G,220,"Moses, raised as a prince of Egypt in the Pharaoh&apos;s household, learns of his true heritage as a Hebrew and his divine mission as the deliverer of his people from slavery.",13282712,65500755
0049261,Velikan,1956,7.6,G,201,Sprawling epic covering the life of a Texas cattle rancher and his family and associates.,5400000,32856387
0049778,Somebody Up There Likes Me,1956,7.5,Approved,113,"Boxer Rocky Graziano&apos;s biopic, based on his autobiography, from childhood to his World Middleweight Championship title win at age 28 in 1947.",1920000,9528
0049777,The Solid Gold Cadillac,1956,7.5,Approved,99,A minority stockholder takes on the crooked board of directors at a billion dollar corporation.,,
0049470,"Mož, ki je vedel preveč",1956,7.4,PG,120,"An American doctor and his wife, a former singing star, witness a murder while vacationing in Morocco, and are drawn into a twisting plot of international intrigue when their young son is kidnapped.",2500000,8645
0049408,The King and I,1956,7.4,G,133,A widow accepts a job as a live-in governess to the King of Siam&apos;s children.,4550000,21310398
0049966,Zapisano v vetru,1956,7.4,Approved,99,"Alcoholic playboy Kyle Hadley marries the woman secretly loved by his poor but hard-working best friend, who in turn is pursued by Kyle&apos;s nymphomaniac sister.",,14163
0049456,Sla po zivljenju,1956,7.3,Approved,122,The life of brilliant but tortured artist Vincent van Gogh.,3227000,
0048947,Anastasia,1956,7.0,Approved,105,"An opportunistic businessman tries to pass off a mysterious impostor as the Grand Duchess Anastasia, and she is so convincing that even the biggest skeptics believe her.",3520000,
0049518,Le monde du silence,1956,6.9,,86,A documentary about the undersea explorers and how they penetrate into the underwater world.,,
0048960,Around the World in Eighty Days,1956,6.7,G,167,A Victorian Englishman bets that with the new steamships and railways he can circumnavigate the globe in eighty days.,6000000,42009549
0049030,The Brave One,1956,6.5,Approved,100,"A young boy named Leonardo adopts a bull after saving it during a storm, but their friendship is soon threatened by the legal owners of the animal who claim ownership of it and ship it off to the bullring to face a legendary bullf...",,
0050212,Most na reki Kwai,1957,8.1,PG,161,"British POWs are forced to build a railway bridge across the river Kwai for their Japanese captors in occupied Burma, not knowing that the allied forces are planning a daring commando raid through the jungle to destroy it.",3000000,27200463
0050783,Cabirijine noči,1957,8.1,Not Rated,110,A waifish prostitute wanders the streets of Rome looking for true love but finds only heartbreak.,,770704
0050356,Obračun na Atlantiku,1957,7.4,Approved,98,"During WWII an American destroyer discovers a German U-boat, and in the ensuing duel the American captain must draw upon all his experience to defeat the equally experienced German commander.",1910000,
0051077,The Three Faces of Eve,1957,7.2,Approved,91,A doctor treats a woman suffering from Multiple Personality Disorder.,965000,
0050933,Sayonara,1957,7.0,Approved,147,A US Air Force major in Kobe confronts his own opposition to marriages between American servicemen and Japanese women when he falls for a beautiful performer.,,
0050569,The Joker Is Wild,1957,7.0,Approved,126,"Frank Sinatra plays Joe E. Lewis, a famous comedian of the 1930s-50s. When the movie opens, Lewis is a young, talented singer who performs in speakeasies. When he bolts one job for another, the mob boss who owns the first speakeas...",,
0050306,Designing Woman,1957,6.7,Approved,118,"A sportswriter and a fashion-designer marry after a whirlwind romance, and discover they have little in common.",,
0050631,Les Girls,1957,6.6,Approved,114,The former members of a dance troupe are suing because of recently published memoirs. Each one insists on own point of view.,,
0050109,Albert Schweitzer,1957,6.0,Approved,85,"This biographical drama/documentary narrative written by Dr. Albert Schweitzer and spoken by Fredric March, traces the life of Dr. Schweitzer (with actors playing the characters), from his birth in France up to about the age of 30...",,
0051411,The Big Country,1958,7.9,Approved,166,"A New England sea captain in the 1880s arrives at his fiancée&apos;s sprawling Texas ranch, where he becomes embroiled in a feud between two families over a valuable patch of land.",,
0050706,Moj stric,1958,7.7,Not Rated,116,"Monsieur Hulot visits the technology-driven world of his sister, brother-in-law, and nephew, but he can&apos;t quite fit into the surroundings.",250000,85822
0051525,The Defiant Ones,1958,7.6,Approved,96,"Two chained-together escaped convicts, White and Black, must learn to get along in order to elude capture.",778000,
0051758,I Want to Live!,1958,7.5,Approved,120,"A prostitute, sentenced to death for murder, pleads her innocence.",1383578,
0053226,Room at the Top,1958,7.5,Not Rated,117,An ambitious young accountant plots to wed a wealthy factory owner&apos;s daughter despite falling in love with a married older woman.,280000,
0052182,Separate Tables,1958,7.4,Approved,100,The stories of several people are told as they stay at a seaside hotel in Bournemouth which features dining at &quot;Separate Tables.&quot;,,
0052027,The Old Man and the Sea,1958,6.9,Not Rated,86,An old Cuban fisherman&apos;s dry spell is broken when he hooks a gigantic fish that drags him out to sea.,5000000,67740
0052225,South Pacific,1958,6.8,Approved,157,"On a South Pacific island during World War II, love blooms between a young nurse and a secretive Frenchman who&apos;s being courted for a dangerous military mission.",6000000,476564
0051658,Gigi,1958,6.6,G,115,"Weary of the conventions of Parisian society, a rich playboy and a youthful courtesan-in-training enjoy a platonic friendship which may not stay platonic for long.",3319355,
0052427,Tom Thumb,1958,6.4,G,98,"A boy (Russ Tamblyn), no bigger than a thumb, manages to outwit two thieves (Terry-Thomas and Peter Sellers) determined to make a fortune from him.",,
0052389,White Wilderness,1958,5.3,Approved,72,The wildlife of the arctic is explored in this true-life adventure.,,
0053291,Nekateri so za vroče,1959,8.2,Approved,121,"After two male musicians witness a mob hit, they flee the state in an all-female band disguised as women, but further complications set in.",2883848,200464
0052618,Ben Hur,1959,8.1,G,212,"After a Jewish prince is betrayed and sent into slavery by a Roman friend in 1st-century Jerusalem, he regains his freedom and comes back for revenge.",15000000,74437981
0053268,Serengeti darf nicht sterben,1959,7.8,,85,The borders of the Serengeti National Park in Tanzania were initially drawn without considering the herds of grass-eating wild animals. The recording of seasonal animal movements by the film team at the end of the 1950s forms the ...,,
0053172,Pillow Talk,1959,7.4,Approved,102,An interior decorator and a playboy songwriter share a telephone party line and size each other up.,,10265
0052738,The Diary of Anne Frank,1959,7.4,Approved,180,"During World War II, a teenage Jewish girl named Anne Frank and her family are forced into hiding in the Nazi-occupied Netherlands.",3800000,
0053146,Orfeu Negro,1959,7.4,PG,100,"A retelling of the Orpheus and Eurydice myth, set during the time of the Carnaval in Rio de Janeiro.",,
0053182,Porgy and Bess,1959,7.0,Not Rated,138,A woman whose past is scorned by nearly everyone around her meets a man who&apos;d love her regardlessly- if only everyone else would allow them to.,7000000,
0052896,A Hole in the Head,1959,6.2,Approved,120,"Widower Tony is trying to keep a small Miami hotel afloat while raising a 12-year-old son. He&apos;s forced to ask his harried brother Mario for help, but he&apos;ll only bail Tony out if he quits his bohemian lifestyle and marries a sensib...",,
0053604,Apartma,1960,8.3,Approved,125,"A Manhattan insurance clerk tries to rise in his company by letting its executives use his apartment for trysts, but complications and a romance of his own ensue.",3000000,18778738
0053779,Sladko zivljenje,1960,8.0,Not Rated,174,A series of stories following a week in the life of a philandering tabloid journalist living in Rome.,,217420
0053976,Jungfrukällan,1960,8.0,Not Rated,89,"In 14th-century Sweden, an innocent yet pampered teenage girl and her family&apos;s pregnant and jealous servant set out from their farm to deliver candles to church, but only one returns from events that transpire in the woods along t...",,1911
0054331,Spartak,1960,7.9,PG-13,197,"The slave Spartacus survives brutal training as a gladiator and leads a violent revolt against the decadent Roman Republic, as the ambitious Crassus seeks to gain power by crushing the uprising.",12000000,1844917
0053793,Elmer Gantry,1960,7.7,Approved,146,"A fast-talking traveling salesman with a charming, loquacious manner convinces a sincere evangelist that he can be an effective preacher for her cause.",3000000,64
0054749,La ciociara,1960,7.7,Not Rated,101,"In WWII Italy, a widow and her lonely daughter seek distance between themselves and the horrors of war.",,14062
0054387,The Time Machine,1960,7.5,G,103,A man&apos;s vision for a utopian society is disillusioned when travelling forward into time reveals a dark and dangerous society.,750000,5902
0054195,Pollyanna,1960,7.4,G,134,A young girl comes to an embittered town and confronts its attitude with her determination to see the best in life.,,
0054198,Nikoli v nedeljo,1960,7.3,Not Rated,91,An American scholar in Greece sets about improving the prostitute with whom he is infatuated.,151000,
0054326,Sinovi in ljubimci,1960,7.1,Approved,103,A young man with artistic talent lives in a close-knit coal-mining town and finds himself inhibited by his emotionally manipulative mother.,500000,
0053580,The Alamo,1960,6.8,Approved,162,"In 1836, a small band of soldiers sacrifice their lives in hopeless combat against a massive army in order to prevent a tyrant from smashing the new Republic of Texas.",12000000,6334
0053804,Exodus,1960,6.7,Approved,208,"The State of Israel is created in 1948, resulting in war with its Arab neighbors.",4000000,12634
0053622,BUtterfield 8,1960,6.3,Not Rated,109,"A beautiful New York model and socialite enjoys a very active night-life, but all things change when she falls for a married man and the consequences are tragic.",2800000,8722
0053810,The Facts of Life,1960,6.3,Approved,103,Sophisticated comedy with Larry and Kitty leaving their spouses for an interlude together.,,
0054993,The Horse with the Flying Tail,1960,6.1,G,48,"A palimino cow pony, through a series of owners and adventures becomes a champion mount for one of the US equestrian team.",,
