id,naslov,ocena,cas,leto,oznaka,opis,cena,zasluzek
0089424,Kiss of the Spider Woman,7.3,120,1985,R,A gay man and a political prisoner are together in a prison. The gay man narrates the stories of two fake movies and his own life.,,17009654
0089276,La historia oficial,7.7,112,1985,Not Rated,"During the final months of Argentinian Military Dictatorship in 1983, a high school teacher sets out to find out who the mother of her adopted daughter is.",,69832
0090203,The Trip to Bountiful,7.4,108,1985,PG,"Carrie Watts is an elderly woman who decides to visit her childhood home in Bountiful one last time. There, she meets a young woman with whom she shares her secrets and memories.",,7491903
0088740,Artie Shaw: Time Is All You&#x27;ve Got,7.1,114,1985,,"Documentary cataloging the life and music of the band leader and clarinetist, Artie Shaw.",250000,
0088857,Broken Rainbow,6.8,70,1985,,"Documentary chronicling the government relocation of 10,000 Navajo Indians in Arizona.",,
0089612,Molly&#x27;s Pilgrim,6.7,24,1985,,"Based on the sensitive children&apos;s book by Barbara Cohen, Molly&apos;s Pilgrim is the story of a young Russian Jewish girl who has emigrated to America with her parents to escape religious persecution.",,
0090965,Down and Out in America,7.2,57,1985,Unrated,"A recession in the mid-1980s affects Minnesota farm workers, unemployed urban workers and the newly homeless in Los Angeles and New York.",,
0091152,Een griekse tragedie,5.3,7,1985,,Three scantily-clad female figures struggle to hold up the crumbling remains of an ancient Greek temple.,,
0090330,Witness to War: Dr. Charlie Clements,6.2,29,1985,,"Documentary of Charlie Clements, a Vietnam War pilot who was convinced by his experiences in the war that he should become a doctor working behind enemy lines.",,
0088332,Up,6.1,14,1985,,"Man (Ed Casaer) sets his pet hawk free and goes on a fantastic hang gliding adventure in search of his old friend. On the way, he encounters a boy (Erick McWayne) on a hillside who he offers to take on a flight.",,
0092099,Top Gun,7.0,109,1986,PG,"The Top Gun Naval Fighter Weapons School is where the best of the best train to refine their elite flying skills. When hotshot fighter pilot Maverick is sent to the school, his reckless attitude and cocky demeanor put him at odds ...",15000000,357288178
0090605,Osmi potnik 2,8.4,137,1986,R,"Decades after surviving the Nostromo incident, Ellen Ripley is sent out to re-establish contact with a terraforming colony but finds herself battling the Alien Queen and her offspring.",18500000,131060248
0091763,Vod smrti,8.1,120,1986,R,"Chris Taylor, a neophyte recruit in Vietnam, finds himself caught in a battle of wills between two sergeants, one good and the other evil. A shrewd examination of the brutality of war and the duality of man in conflict.",6000000,138546255
0091064,Muha,7.6,96,1986,R,A brilliant but eccentric scientist begins to transform into a giant man/fly hybrid after one of his experiments goes horribly wrong.,15000000,60629159
0091530,The Mission,7.4,125,1986,PG,Eighteenth-century Spanish Jesuits try to protect a remote South American tribe in danger of falling under the rule of pro-slavery Portugal.,24500000,17504819
0090863,Barva denarja,7.0,119,1986,R,"Fast Eddie Felson teaches a cocky but immensely talented protégé the ropes of pool hustling, which in turn inspires him to make an unlikely comeback.",14500000,52293982
0091167,Hannah in njeni sestri,7.8,107,1986,PG-13,"Between two Thanksgivings two years apart, Hannah&apos;s husband falls in love with her sister Lee, while her hypochondriac ex-husband rekindles his relationship with her sister Holly.",6400000,40084041
0090830,Children of a Lesser God,7.2,119,1986,R,"A new speech teacher at a school for the deaf falls in love with the janitor, a deaf woman speechless by choice.",10500000,31853080
0090557,&#x27;Round Midnight,7.4,133,1986,R,"A troubled, but talented musician flees the US to escape his problems, finding refuge and support in Paris.",3000000,3272593
0090576,De aanslag,7.2,141,1986,PG,"A Dutch doctor, haunted by grueling childhood memories of World War II, struggles to find peace as he spends his life looking for answers about the tragic night that shaped him.",,512403
0091787,Precious Images,7.5,8,1986,,"A montage of nearly 500 film clips from eight decades of American movies, made to commemorate the 50th anniversary of the Director&apos;s Guild of America.",,
0092235,"Women - for America, for the World",5.7,30,1986,,22 prominent American women discuss their activism for nuclear disarmament and their motivations in seeking the end of the arms race.,,
0093870,RoboCop,7.6,102,1987,R,"In a dystopian, crime-ridden Detroit, Michigan, young police officer Alex Murphy is brutally murdered by a ruthless gang, only to be resurrected by a powerful corporation as the cyborg RoboCop, who soon seeks revenge on his killers.",13000000,53429740
0092890,Umazani ples,7.1,100,1987,PG-13,"Spending the summer at a Catskills resort with her family, Frances &quot;Baby&quot; Houseman falls in love with the camp&apos;s dance instructor, Johnny Castle.",6000000,214577242
0094226,Nedotakljivi,7.8,119,1987,R,"During Prohibition, Treasury agent Eliot Ness sets out to stop ruthless Chicago gangster Al Capone, and assembles a small, incorruptible team to help him.",25000000,76272360
0093565,Moonstruck,7.2,102,1987,PG,"Loretta Castorini, a bookkeeper from Brooklyn, New York, finds herself in a difficult situation when she falls for the brother of the man she has agreed to marry.",15000000,80646431
0094291,Wall Street,7.3,126,1987,R,"An impatient young stockbroker is willing to do anything to get to the top, including trading on illegal inside information taken through a ruthless, greedy corporate raider who takes the youth under his wing.",15000000,43848069
0093389,The Last Emperor,7.7,163,1987,PG-13,Bernardo Bertolucci&apos;s Oscar-winning dramatization of China&apos;s eleventh and final monarch of the Qing dynasty: Emperor Puyi.,23000000,43994979
0093148,Harry and the Hendersons,6.1,110,1987,PG,The Henderson family adopt a friendly Sasquatch but have a hard time trying to keep the legend of &apos;Bigfoot&apos; a secret.,10000000,49998613
0093260,Mikrokozmos,6.8,120,1987,PG,"A test pilot is miniaturized in a secret experiment, and accidentally injected into a hapless store clerk.",27000000,25893810
0092603,Babettes gæstebud,7.8,103,1987,G,"During the late 19th century, a strict religious community in a Danish village takes in a French refugee from the Franco-Prussian War as a servant to the late pastor&apos;s daughters.",,4637920
0093713,Pelle erobreren,7.7,157,1987,PG-13,"When his wife dies, Lasse takes his 12-year-old son, Pelle, from their home in Sweden to Denmark in search of a better life.",,2063688
0093488,L&#x27;homme qui plantait des arbres,8.5,30,1987,,The story of a shepherd&apos;s single handed quest to re-forest a barren valley.,,
0093826,Ray&#x27;s Male Heterosexual Dance Hall,6.8,23,1987,,"In this short film, our unemployed hero finds that getting a great job depends a lot on whom you choose to dance with at Ray&apos;s Male Heterosexual Dance Hall.",,
0094363,Young at Heart,6.6,29,1987,Not Rated,"The painter couple Louis Gothelf and Reva Schwayder, aged around 85, talk about their life, their encounter and their romance.",,
0364151,American Masters,8.2,90,1985,TV-14,Documentary series focusing on great American artists and personalities.,104850,
0094721,Beetlejuice,7.5,92,1988,PG,"The spirits of a deceased couple are harassed by an unbearable family that has moved into their home, and hire a malicious spirit to drive them out.",15000000,74852535
0095953,Dezevni clovek,8.0,133,1988,R,"After a selfish L.A. yuppie learns his estranged father left a fortune to an autistic-savant brother in Ohio that he didn&apos;t know existed, he absconds with his brother and sets out across the country, hoping to gain a larger inheri...",25000000,354825435
0095765,Novi kino Paradiz,8.5,174,1988,PG,"Salvatore, a famous film director, returns to his hometown for the funeral of the local theater&apos;s film projectionist, Alfredo. He reminisces about his life as a young boy falling in love with cinema.",5000000,13030027
0096438,Kdo je potunkal Rogerja zajca,7.7,104,1988,PG,"When a cartoon rabbit is accused of murder, he enlists the help of a burnt out private investigator to prove his innocence.",70000000,329803958
0095647,Mississippi v plamenih,7.8,128,1988,R,Two FBI agents with wildly different styles arrive in Mississippi to investigate the disappearance of three civil rights activists.,15000000,34603943
0094947,Nevarna razmerja,7.5,119,1988,R,A scheming widow and her manipulative ex-lover make a bet regarding the corruption of a recently married woman.,14000000,34670720
0095159,A Fish Called Wanda,7.5,108,1988,R,"In London, four very different people team up on a jewel heist, then try to double-cross one another for the loot, complicated by their efforts to fool the very proper barrister Archibald Leach.",7500000,62493712
0094608,Obtozena,7.1,111,1988,R,"After a young woman suffers a brutal gang rape in a bar one night, a prosecutor assists in bringing the perpetrators to justice, including the ones who encouraged and cheered on the attack.",13000000,32078318
0096463,Zeposleno dekle,6.8,113,1988,R,"When a secretary&apos;s idea is stolen by her boss, she seizes an opportunity to steal it back by pretending she has her boss&apos; job.",28000000,102953112
0094606,The Accidental Tourist,6.7,121,1988,PG,An emotionally distant writer of travel guides must carry on with his life after his son is killed and his marriage crumbles.,,32632093
0094747,Bird,7.1,161,1988,R,The troubled life and career of jazz musician Charlie Parker.,9000000,2191875
0095638,The Milagro Beanfield War,6.8,117,1988,R,The accidental breakdown of an irrigation valve launches a hot confrontation between the mainly Latino farmers in a tiny New Mexico town and the real estate developers and politicians determined to acquire their land for a golf re...,22000000,13825794
0096273,Tin Toy,6.5,5,1988,G,A one-man-band tin toy tries to escape a destructive baby.,,123967
0095341,Hôtel Terminus,7.6,267,1988,Unrated,"A documentary about Klaus Barbie, the Gestapo chief of Lyon, and his life after the war.",,
0094670,The Appointments of Dennis Jennings,7.0,29,1988,,"Dennis Jennings is an introverted daydreamer, sleepwalking through life. He is a professional waiter and has an equally-dull girlfriend, Emma. In an attempt to release his pent-up feelings of isolation, he begins seeing a psychiat...",,
0096484,You Don&#x27;t Have to Die,6.9,27,1988,,A young boy&apos;s successful battle against cancer and his subsequent efforts to help other children overcome their fears of the illness.,,
0097576,Indiana Jones in Zadnji križarski pohod,8.2,127,1989,PG-13,"In 1938, after his father goes missing while pursuing the Holy Grail, Indiana Jones finds himself up against the Nazis again to stop them from obtaining its powers.",48000000,474171806
0097165,Drustvo mrtvih pesnikov,8.1,128,1989,PG,"Maverick teacher John Keating returns in 1959 to the prestigious New England boys&apos; boarding school where he was once a star student, using poetry to embolden his pupils to new heights of self-expression.",16400000,235860116
0096895,Batman,7.5,126,1989,PG-13,"The Dark Knight of Gotham City begins his war on crime with his first major enemy being Jack Napier, a criminal who becomes the clownishly homicidal Joker.",35000000,411569241
0096754,Brezno,7.5,140,1989,PG-13,A civilian diving team is enlisted to search for a lost nuclear submarine and faces danger while encountering an alien aquatic species.,70000000,90520202
0097757,Mala morska deklica,7.6,83,1989,G,A mermaid princess makes a Faustian bargain in an attempt to become human and win a prince&apos;s love.,40000000,211343479
0097441,Bitka za slavo,7.8,122,1989,R,"Robert Gould Shaw leads the U.S. Civil War&apos;s first all-black volunteer company, fighting prejudices from both his own Union Army, and the Confederates.",18000000,26979166
0096969,Rojen četrtega julija,7.2,145,1989,R,"The biography of Ron Kovic. Paralyzed in the Vietnam war, he becomes an anti-war and pro-human rights political activist after feeling betrayed by the country for which he fought.",14000000,161001698
0097239,Šofer gospodične Daisy,7.3,99,1989,PG,An old Jewish woman and her African-American chauffeur in the American South have a relationship that grows and improves over the years.,7500000,145793296
0097937,Moja leva noga,7.8,103,1989,R,"Christy Brown, born with cerebral palsy, learns to paint and write with his only controllable limb - his left foot.",600000,14743391
0097499,Henrik V,7.5,137,1989,PG-13,"In the midst of the Hundred Years War, the young King Henry V of England embarks on the conquest of France in 1415.",9000000,10161211
0099317,Creature Comforts,7.7,5,1989,TV-G,A humourous and thought-provoking view of what animals in zoos might be thinking about their captivity and surroundings.,,
0097099,Common Threads: Stories from the Quilt,8.1,79,1989,,A collection of profiles of people dead from AIDS who are remembered in the AIDS Memorial Quilt.,,
0096880,Balance,7.9,7,1989,,A group of fishermen on a precariously balanced platform fight over a trunk.,,45194
0100076,The Lunch Date,7.5,12,1989,,"A woman misses her train and buys lunch in a café. When she returns to her table, a man is eating her salad.",,
0097628,The Johnstown Flood,7.4,26,1989,,"On May 30, 1889 the South Fork Dam, which maintained a pleasure lake for wealthy Pittsburgh industrialists and their families, failed due to very heavy rains and poor maintenance by the dam&apos;s owners. The burst dam sent a wall of w...",,
0098677,Work Experience,6.6,11,1989,,"Terence is caught in a vicious circle. he cannot get a job because he has no experience, but he cannot gain experience without getting a job!",,
0099685,Dobri fantje,8.7,145,1990,R,"The story of Henry Hill and his life in the mafia, covering his relationship with his wife Karen and his mob partners Jimmy Conway and Tommy DeVito.",25000000,47068004
0100802,Total Recall,7.5,113,1990,R,"When a man goes in to have virtual vacation memories of the planet Mars implanted in his mind, an unexpected and harrowing series of events forces him to go to the planet for real - or is he?",65000000,261317921
0100157,Misery,7.8,107,1990,R,"After a famous author is rescued from a car crash by a fan of his novels, he comes to realize that the care he is receiving is only the beginning of a nightmare of captivity and abuse.",20000000,61277597
0099348,Plese z volkovi,8.0,181,1990,PG-13,A lieutenant assigned to a remote Civil War outpost starts questioning his purpose after making contact with a neighboring Sioux settlement.,22000000,424208848
0099653,Duh,7.1,126,1990,PG-13,"After a young man is murdered, his spirit stays behind to warn his lover of impending danger, with the help of a reluctant psychic.",22000000,505703557
0099810,Lov na rdeči oktober,7.5,135,1990,PG,"In November 1984, the Soviet Union&apos;s best submarine captain violates orders and heads for the U.S. in a new undetectable sub. The American CIA and military must quickly determine: Is he trying to defect or to start a war?",30000000,200512643
0099422,Dick Tracy,6.2,105,1990,PG,The comic strip detective finds his life vastly complicated when Breathless Mahoney makes advances towards him while he is trying to battle Big Boy Caprice&apos;s united mob.,47000000,162738726
0100486,Reversal of Fortune,7.2,111,1990,R,"Wealthy Sunny von Bülow lies brain-dead, husband Claus guilty of attempted murder; but he says he&apos;s innocent and hires Alan Dershowitz for his appeal.",,15445131
0099334,Cyrano de Bergerac,7.5,137,1990,PG,"Famed swordsman and poet Cyrano de Bergerac is in love with his cousin Roxane. He has never expressed his love for her as he his large nose undermines his self-confidence. Then he finds a way to express his love to her, indirectly.",100000000,5822041
0099028,American Dream,7.8,98,1990,PG-13,Recounts the 1985-86 strike against the Hormel Foods Corporation in Minnesota after its employees&apos; wages and benefits were cut.,,269823
0100470,Reise der Hoffnung,7.5,105,1990,PG,"The story of a Turkish Alevi family trying to illegally emigrate to Switzerland, a country they know only from a postcard.",,261718
0102926,Ko jagenjčki obmolknejo,8.6,118,1991,R,"A young F.B.I. cadet must receive the help of an incarcerated and manipulative cannibal killer to help catch another serial killer, a madman who skins his victims.",19000000,272742922
0103064,Terminator 2 - Sodni dan,8.6,137,1991,R,"A cyborg, identical to the one who failed to kill Sarah Connor, must now protect her ten year old son John from an even more advanced and powerful cyborg.",102000000,517778573
0103074,Thelma in Louise,7.6,130,1991,R,"Two best friends set out on an adventure, but it soon turns around to a terrifying escape from being hunted by the police, as these two women escape for the crimes they committed.",16500000,45473912
0101414,Lepotica in zver,8.0,84,1991,G,A prince cursed to spend his days as a hideous monster sets out to regain his humanity by earning a young woman&apos;s love.,25000000,451291298
0102138,J.F.K.,8.0,189,1991,R,New Orleans District Attorney Jim Garrison discovers there&apos;s more to the Kennedy assassination than the official story.,40000000,205405498
0101889,Kraljevi ribic,7.5,137,1991,R,"A former radio DJ, suicidally despondent because of a terrible mistake he made, finds redemption in helping a deranged homeless man who was an unwitting victim of that mistake.",24000000,41895736
0101587,Mestni fantje,6.8,113,1991,PG-13,"On the verge of turning 40, an unhappy Manhattan yuppie is roped into joining his two friends on a cattle drive in the southwest.",27000000,179033791
0101516,Bugsy,6.8,136,1991,R,"The true story of gangster Benjamin &quot;Bugsy&quot; Siegel, his tumultuous affair with the tough-talking Virginia Hill, and how he founded the Nevada-based city that would go on to be known as Las Vegas.",30000000,49114016
0102426,Mediterraneo,7.4,96,1991,R,"In WW2, an Italian Army unit of misfits occupies an isolated non-strategic Greek island for the duration of the war.",,4532791
0099372,Days of Waiting,7.5,28,1991,,"The story of Estelle Ishigo, one of the few whites interned with Japanese Americans during World War II. The wife of a Japanese American, Ishigo refused to be separated from her husband and was interned along with him. Based on th...",,
0108086,Session Man,6.5,31,1991,,Classic hard rock band Raging Kings is making a new record. Talented session guitarist McQueen is called in to replace their disgruntled band member for one recording session. Could this be his one shot at success?,,
0102392,Manipulation,6.8,7,1991,,"A discarded cartoon character and some spilt ink combine and interact as if the cartoonist had drawn their actions. Discovering them, the cartoonist then joins in the interaction.",,
0101683,"Deadly Deception: General Electric, Nuclear Weapons and Our Environment",6.7,27,1991,,This 1991 Academy Award®-winning documentary uncovers the disastrous health and environmental side effects caused by the production of nuclear materials by the General Electric Corporation.,,
0102114,In the Shadow of the Stars,6.5,93,1991,Not Rated,"Winner of the Academy Award for Best Documentary Feature, this film is a hilarious and affectionate look at the path to stardom inside the competitive world of opera.",,
0104952,Moj bratranec Vinny,7.6,120,1992,R,"Two New Yorkers accused of murder in rural Alabama while on their way back to college call in the help of one of their cousins, a loudmouth lawyer with no trial experience.",11000000,64088552
0103874,Drakula,7.4,128,1992,R,The centuries old vampire Count Dracula comes to England to seduce his barrister Jonathan Harker&apos;s fiancée Mina Murray and inflict havoc in the foreign land.,40000000,215862692
0105323,Vonj po ženski,8.0,156,1992,R,"A prep school student needing money agrees to &quot;babysit&quot; a blind man, but the job is not at all what he anticipated.",31000000,134095253
0104691,Poslednji Mohikanec,7.6,112,1992,R,Three Mohican trappers agree to protect the daughters of a British Colonel in the midst of the French and Indian War.,40000000,75506530
0104070,Smrt ji lepo pristoji,6.7,104,1992,PG-13,"When a fading actress learns of an immortality treatment, she sees it as a way to outdo her long-time rival.",55000000,149022650
0105695,Neoproščeno,8.2,130,1992,R,Retired Old West gunslinger Will Munny reluctantly takes on one last job to avenge an injustice with the help of his old partner and a newer outlaw known simply as The Schofield Kid.,14400000,159167799
0103639,Aladin,8.0,90,1992,G,A kind-hearted street urchin and a power-hungry Grand Vizier vie for a magic lamp that has the power to make their deepest wishes come true.,28000000,504050219
0105265,Reka poje mi,7.2,123,1992,PG,"Two sons of a stern minister - one reserved, one rebellious - grow up in rural 1920s Montana while devoted to fly fishing.",12000000,43440294
0104036,Igra solz,7.2,112,1992,R,"A British soldier kidnapped by the IRA soon befriends one of his captors, who then becomes drawn into the soldier&apos;s world.",2300000,62549086
0104454,Howards End,7.4,142,1992,PG,"Set in the early 20th century, class distinctions and troubled relations affect the relationship between two families and the ownership of a cherished British estate known as Howards End.",,26476514
0104507,Indochine,7.0,160,1992,PG-13,"Eliane adopts Camille, whose Vietnamese parents were friends. In 1930, a French navy officer is interested in Eliane (owns 60km2 plantation) and later in Camille. There&apos;s an uprising in Vietnam against French colonial power.",,5603158
0103791,Zlati casi,7.1,109,1992,R,A 1931 Spanish military deserter finds himself on a lonely farm until the farmer&apos;s four daughters pay a visit and he falls for all of them.,,5418502
0105089,The Panama Deception,7.5,91,1992,,A film about the true reasons for the 1989 US invasion of Panama and big media complicity in these activities.,,309596
0105051,Omnibus,7.2,8,1992,,A commuter suddenly realizes he&apos;s mistakenly boarded the express train and desperately tries to get off between stations.,,
0104908,Mona Lisa Descending a Staircase,6.9,7,1992,TV-G,Two-dimensional clay animations melding and merging the work of 35 famous artists.,,
0104167,Educating Peter,7.3,30,1992,,"Peter Gwazdauskas, a child with Down Syndrome, attends a normal school with regular students. The documentary follows Peter and how much he has improved throughout the school year.",,
0108052,Schindlerjev seznam,9.0,195,1993,R,"In German-occupied Poland during World War II, industrialist Oskar Schindler gradually becomes concerned for his Jewish workforce after witnessing their persecution by the Nazis.",22000000,322161245
0107290,Jurski park,8.2,127,1993,PG-13,"An industrialist invites some experts to visit his theme park of cloned dinosaurs. After a power failure, the creatures run loose, putting everyone&apos;s lives, including his grandchildren&apos;s, in danger.",63000000,1104379926
0107614,Gospa Doubtfire - Očka v krilu,7.1,125,1993,PG-13,"After a bitter divorce, an actor disguises himself as a female housekeeper to spend time with his children held in custody by his former wife.",25000000,441286195
0106977,Ubežnik,7.8,130,1993,PG-13,"Dr. Richard Kimble, unjustly accused of murdering his wife, must find the real killer while being the target of a nationwide manhunt led by a seasoned U.S. Marshal.",44000000,368875760
0106226,Cas nedolznosti,7.2,139,1993,PG,"A tale of nineteenth-century New York high society in which a young lawyer falls in love with a woman separated from her husband, while he is engaged to the woman&apos;s cousin.",34000000,32255953
0107822,Klavir,7.5,121,1993,R,"In the mid-19th century a mute woman is sent to New Zealand along with her young daughter and prized piano for an arranged marriage to a farmer, but is soon lusted after by a farm worker.",7000000,40185766
0107818,Filadelfija,7.7,125,1993,PG-13,"When a man with HIV is fired by his law firm because of his condition, he hires a homophobic small-time lawyer as the only willing advocate for a wrongful dismissal suit.",26000000,206678440
0108598,The Wrong Trousers,8.3,30,1993,TV-PG,"Gromit butts heads with a mysterious penguin lodger, who hatches a sinister scheme involving the ex-NASA Techno Trousers that have been modified by Wallace for walkies.",,
0106961,Franz Kafka&#x27;s It&#x27;s a Wonderful Life,7.2,23,1993,Not Rated,"While trying to decide what Gregor Samsa wakes up as, Kafka&apos;s constantly being interrupted by knife-selling strangers, party noise, girls, fancy dress costumes, and other strange, dreamlike visions.",,
0106446,Bob&#x27;s Birthday,7.0,12,1993,,"A devoted and happily-married housewife organises a surprise party on the occasion of her husband&apos;s birthday, unbeknownst to her that her dentist spouse is experiencing a sudden mid-life crisis at his office.",,
0108056,Schwarzfahrer,7.6,12,1993,Not Rated,"A young black man is verbally harassed by an older woman on a streetcar, while the other passengers remain silent. He finally exacts his revenge.",,
0107177,I Am a Promise: The Children of Stanton Elementary School,7.0,89,1993,,Filmmakers Alan Raymond and Susan Raymond document Philadelphia teachers facing challenges at an inner-city school.,,
0110912,Šund,8.9,154,1994,R,"The lives of two mob hitmen, a boxer, a gangster and his wife, and a pair of diner bandits intertwine in four tales of violence and redemption.",8000000,213928762
