id,naslov,ocena,cas,leto,oznaka,opis,cena,zasluzek
0043014,Sunset Boulevard,8.4,110,1950,Approved,A screenwriter develops a dangerous relationship with a faded film star determined to make a triumphant return.,1752000,310112
0042192,Vse o Evi,8.2,138,1950,Approved,A seemingly timid but secretly ruthless ingénue insinuates herself into the lives of an aging Broadway star and her circle of theater friends.,1400000,154736
0042876,V gozdu,8.2,88,1950,Not Rated,"The rape of a bride and the murder of her samurai husband are recalled from the perspectives of a bandit, the bride, the samurai&apos;s ghost and a woodcutter.",250000,139819
0042546,Harvey,7.9,104,1950,Approved,"A whimsical man is thought to be insane due to his insistence that he is best friends with an invisible, humanoid rabbit, but he may be wiser than anyone knows.",,877
0042646,King Solomon&#x27;s Mines,6.7,103,1950,Approved,Adventurer Allan Quartermain leads an expedition into uncharted African territory in an attempt to locate an explorer who went missing during his search for the fabled diamond mines of King Solomon.,2258000,951
0042276,Born Yesterday,7.5,103,1950,Approved,"While in Washington to lobby for favorable legislation, a garbage tycoon hires a reporter to teach his ex-showgirl mistress proper etiquette to better fit in with high society, but she ends up learning more than he bargained for.",,12000000
0042367,Cyrano de Bergerac,7.4,113,1950,Approved,"The charismatic swordsman-poet and provocateur in 1640s Paris helps a young guardsman woo the woman he loves, complicated by the politics of the nobility and the war with Spain.",400000,
0042832,Panic in the Streets,7.2,96,1950,Approved,A doctor and a policeman in New Orleans have only 48 hours to locate a killer infected with pneumonic plague.,1400000,43
0042200,Annie Get Your Gun,6.8,107,1950,Approved,"The story of the great sharpshooter Annie Oakley, who rose to fame while dealing with her love/professional rival, Frank Butler.",3768785,
0042393,Destination Moon,6.3,92,1950,Approved,"&quot;Destination Moon&quot;, tells the tale of when Doctor Charles Cargraves and retired General Thayer approach Jim Barnes, the head of his own aviation construction firms to help build a rocket that will take them to the moon.",592000,
0042949,Seven Days to Noon,7.0,94,1950,Not Rated,"When a scientist threatens to detonate a powerful bomb in the heart of London, Scotland Yard has just seven days to find him before it is too late.",,
0042650,Kon-Tiki,7.9,77,1950,Approved,A documentary about the Kon-Tiki expedition of the Norwegian explorer Thor Heyerdahl.,,
0043581,Gerald McBoing-Boing,7.1,8,1950,Approved,The story of a little boy who would only talk in sound effects.,,
0042592,Beaver Valley,6.9,32,1950,Approved,"Get a glimpse of &quot;nature&apos;s own engineer&quot; hard at work. A young male beaver must defend his new family against hungry predators, mischievous river otters and the ever-impending threat of winter.",,
0043050,The Titan: Story of Michelangelo,6.5,70,1950,Not Rated,"The story follows Michelangelo&apos;s life, career, and renowned artworks from his early works to lasting fame, showcasing detailed looks at his most celebrated creations against the backdrop of his era.",,
0041130,Aquatic House Party,5.2,9,1950,,This short is about a visionary indoor/outdoor combo swimming pool in a California home that is equipped with cutting edge modern mid-20th century features.,,
0042518,Grandad of Races,5.7,9,1950,Approved,"The annual horse race held in the Piazza del Campo in Siena is highlighted in all its color, pomp, and pageantry.",,
0044081,Tramvaj Pozelenje,7.9,122,1951,Approved,Disturbed Blanche DuBois moves in with her sister in New Orleans and is tormented by her brutish brother-in-law while her reality crumbles around her.,1800000,54695
0043265,The African Queen,7.7,105,1951,PG,"In WWI East Africa, a gin-swilling Canadian riverboat captain is persuaded by a strait-laced English missionary to undertake a trip up a treacherous river and use his boat to attack a German gunship.",1000000,46305
0043278,Amerikanec v Parizu,7.1,114,1951,Approved,Three friends struggle to find work in Paris. Things become more complicated when two of them fall in love with the same woman.,2723903,275077
0043924,A Place in the Sun,7.7,122,1951,Approved,A poor boy gets a job working for his rich uncle and ends up falling in love with two women.,2295304,748
0044829,The Lavender Hill Mob,7.5,78,1951,Approved,A meek bank clerk who oversees the shipment of bullion joins with an eccentric neighbor to steal gold bars and smuggle them out of the country as miniature Eiffel Towers.,,32232
0044207,Ko trčijo svetovi,6.6,83,1951,G,"As a new star and planet hurtle toward a doomed Earth, a small group of survivalists frantically work to complete the rocket which will take them to their new home.",936000,
0043599,The Great Caruso,6.5,109,1951,Approved,"The film explores the life of tenor Enrico Caruso, a vocalist who faces rejection from Musetta and Dorothy, and struggles to find acceptance in New York.",,
0043633,Here Comes the Groom,6.3,113,1951,Approved,"Foreign correspondent Pete Garvey has 5 days to win back his former fiancée, or he&apos;ll lose the orphans he adopted.",2117000,
0043334,Benjy,6.9,31,1951,,"An orthopedic pediatrician wants to cure a scoliosis patient, but first he needs to convince the parents, who have rejected the child because of his disabilities.",,
0043839,Nature&#x27;s Half Acre,7.0,33,1951,Approved,"The strange and wonderful world that lies beneath our feet, under leaf, log and rock, peopled by millions of weird and fascinating creatures.",,
0044218,World of Kids,4.5,10,1951,,Youngsters demonstrate their skill at a variety of sports.,,
0043135,Why Korea?,5.2,30,1951,,"This film examines the reasons why the United States decided to engage in the Korean War. Scenes describe Russia&apos;s attempt to gain power following World War II (Korea included), and its refusal to allow free elections in the count...",,
0044706,Točno opoldne,7.9,85,1952,PG,"A town Marshal, despite the disagreements of his newlywed bride and the townspeople around him, must face a gang of deadly killers alone at &quot;high noon&quot; when the gang leader, an outlaw he &quot;sent up&quot; years ago, arrives on the noon tr...",730000,217
0045061,Mirni moz,7.7,129,1952,Approved,"A retired American boxer returns to the village of his birth in 1920s Ireland, where he falls for a spirited redhead whose brother is contemptuous of their union.",1750000,
0044672,The Greatest Show on Earth,6.5,152,1952,Approved,"The dramatic lives of trapeze artists, a clown, and an elephant trainer are told against a background of circus spectacle.",4000000,36000000
0043686,Jeux interdits,8.0,86,1952,Not Rated,"A young French girl orphaned in a German air attack is befriended by the son of a poor farmer, and together they try to come to terms with the realities of death.",,25512
0044391,The Bad and the Beautiful,7.7,118,1952,Approved,"An unscrupulous movie producer uses an actress, a director and a writer to achieve success.",1558000,2025
0044837,Odrske luči,8.0,137,1952,G,A fading comedian and a suicidally despondent ballet dancer must look to each other to find purpose and hope in their lives.,,9291
0045296,Viva Zapata!,7.2,113,1952,Approved,"The story of Mexican revolutionary Emiliano Zapata, who led a rebellion against the corrupt, oppressive dictatorship of President Porfirio Díaz in the early 20th century.",1800000,
0044926,Moulin Rouge,7.0,119,1952,Approved,Fictional account of French artist Henri de Toulouse-Lautrec.,1500000,3188
0044509,"Come Back, Little Sheba",7.5,99,1952,Approved,"An emotionally remote recovering alcoholic and his dowdy, unambitious wife face a personal crisis when they take in an attractive lodger.",,
0044446,The Sound Barrier,6.7,118,1952,Approved,Fictionalized story of British aerospace engineers solving the problem of supersonic flight.,250000,
0045333,With a Song in My Heart,6.7,117,1952,Approved,A talented singer&apos;s musical career begins to soar.,,
0045039,Plymouth Adventure,6.2,105,1952,Approved,"Trials and tribulations beset the one hundred odd settlers that journey to Virginia in 1620 including unexpectedly arriving in Plymouth, Massachusetts.",3185000,
0044958,Neighbours,7.9,8,1952,Not Rated,A surreal story of two neighbours&apos; destructive feud over a flower.,,
0044157,The Two Mouseketeers,7.5,8,1952,Approved,"This Tom and Jerry cartoon is set in 17th century France. Tom, who is a soldier in the King&apos;s castle, is assigned to guard the food laid out on a banquet table. Jerry and a smaller mouse companion, two wandering &quot;mouseketeers,&quot; ma...",,
0045314,Water Birds,6.6,30,1952,Approved,"From the still waters of lagoons and marshes to the wild blue wilderness of the vast oceans, experience the beauty and variety of these majestic birds, each perfectly designed for its habitat.",,
0044836,Light in the Window,5.4,10,1952,Approved,An innovative profile of the painter Johannes Vermeer.,,
0046250,Rimske pocitnice,8.0,118,1953,Approved,A bored and sheltered princess escapes her guardians and falls in love with an American newsman in Rome.,1500000,103197
0045793,Od tod do večnosti,7.6,118,1953,Approved,"At a U.S. Army base in 1941 Hawaii, a pugilistic private is cruelly punished for refusing to join his unit&apos;s boxing team. Meanwhile, his commanding officer&apos;s wife and top NCO are indulging in a torrid love affair.",1650000,36416
0046303,Shane,7.6,118,1953,Approved,An ex-gunfighter defends homesteaders in 1889 Wyoming.,3100000,21412
0046534,Planetarna bitka,7.0,87,1953,G,"A small town in California is attacked by Martians, beginning a worldwide invasion.",2000000,
0046359,Stalag 17,7.9,120,1953,Approved,"After two Americans are killed while escaping from a German P.O.W. camp in World War II, the barracks black marketeer, J.J. Sefton, is suspected of being an informer.",1661530,
0046247,The Robe,6.7,135,1953,Approved,"In the Roman province of Judea during the 1st century, Roman tribune Marcellus Gallio is ordered to crucify Jesus of Nazareth but is tormented by his guilty conscience afterwards.",5000000,36010866
0045591,Calamity Jane,7.2,101,1953,Approved,"The story of Calamity Jane, her saloon, and her romance with Wild Bill Hickok.",,9215
0045943,Julius Caesar,7.2,120,1953,Approved,The growing ambition of Julius Caesar is a source of major concern to his close friend Brutus. Cassius persuades him to participate in his plot to assassinate Caesar but they have both sorely underestimated Mark Antony.,2070000,10831
0046435,Titanic,7.0,98,1953,Approved,"An unhappily married couple struggle to deal with their problems while on board the luxurious, ill-fated RMS Titanic.",1805000,
0046000,Lili,7.2,81,1953,Approved,An orphaned young woman becomes part of a puppet act and forms a relationship with the anti-social puppeteer.,1353000,
0045935,Vrata pekla,7.1,89,1953,Not Rated,A samurai pursues a married lady-in-waiting.,,7375
0045592,Call Me Madam,6.7,114,1953,Approved,Washington hostess Sally Adams becomes a Truman-era US ambassador to a European grand duchy.,,
0046006,The Kidnappers,7.1,93,1953,Approved,"Harry and Davy, two orphaned boys raised by authoritarian grandparents in Nova Scotia, yearn for a dog despite their grandfather&apos;s stern refusal, mirroring other children&apos;s pet ownership.",,
0046008,The Living Desert,7.3,69,1953,Approved,"Although first glance reveals little more than stones and sand, the desert is alive. Witness moving rocks, spitting mud pots, gorgeous flowers and the never-ending battle for survival between creatures of every shape, size and des...",,
0044009,The Sea Around Us,6.1,62,1953,Approved,Oscar-winning documentary based on Rachel L. Carson&apos;s pioneering study of ocean life chronicled in her award-winning and best-selling 1951 book of the same name.,,
0046442,Toot Whistle Plunk and Boom,7.1,10,1953,Approved,A crash course on the history of Western musical instruments.,,
0045937,Johann Mouse,7.4,8,1953,Approved,Tom attempts to catch Jerry by playing music he dances to.,,
0045545,Bear Country,7.6,33,1953,Approved,The lives of black bears in Yellowstone National Park.,,
0045485,The Alaskan Eskimo,6.5,27,1953,G,"Depicts the everyday home life of the families in a typical Eskimo village. The building and hunting activities of the summer, the winter activities underground when the blizzards come, and the celebration of spring with the &quot;mask...",,
0046154,Overture to The Merry Wives of Windsor,6.2,9,1953,Approved,Johnny Green conducts the MGM Symphony Orchestra in a performance of the title work.,,
0047296,Na pristaniški obali,8.1,108,1954,Approved,"An ex-prize fighter turned New Jersey longshoreman struggles to stand up to his corrupt union bosses, including his older brother, as he starts to connect with the grieving sister of one of the syndicate&apos;s victims.",910000,3768
0047437,Sabrina,7.6,113,1954,Approved,"After her return from school in Paris, a playboy finally takes notice of his family&apos;s chauffeur&apos;s daughter, who&apos;s long had a crush on him, but he questions his more serious brother&apos;s motives when he warns against getting involved ...",2238813,2635
0047472,Seven Brides for Seven Brothers,7.3,102,1954,Approved,"When a backwoodsman in 1850s Oregon brings a wife home to his farm, his six brothers decide that they want to get married too.",2540000,14839
0046672,"20,000 Leagues Under the Sea",7.2,127,1954,G,"A ship sent to investigate a wave of mysterious sinkings encounters the advanced submarine, the Nautilus, commanded by Captain Nemo.",9000000,746
0047528,Cesta,8.0,108,1954,Not Rated,"A care-free girl is sold to a traveling entertainer, consequently enduring physical and emotional pain along the way.",,41362
0046754,The Barefoot Contessa,6.9,128,1954,Approved,"This is the life of a Hollywood movie star named Maria, as told by writer/director Harry Dawes, from being discovered in Madrid, Spain, until her funeral in Italy.",,18437
0047030,Zgodba o Glennu Millerju,7.3,115,1954,Approved,Biography of bandleader Glenn Miller from his beginnings to his death over the English Channel in December 1944.,,994
0047086,The High and the Mighty,6.6,147,1954,Approved,"When a commercial airliner develops engine problems on a trans-Pacific flight and the pilot loses his nerve, it is up to the washed-up co-pilot Dan Roman to bring the plane in safely.",1470000,4334
0046874,The Country Girl,7.2,104,1954,Approved,"A director hires an alcoholic has-been and strikes up a stormy relationship with the actor&apos;s wife, who he believes is the cause of all the man&apos;s problems.",,
0047444,Miyamoto Musashi,7.4,93,1954,Not Rated,"Depicts the early life of the legendary warrior Musashi Miyamoto; his years as an aspiring warrior, an outlaw and finally a true samurai.",,
0046806,The Bridges at Toko-Ri,6.7,102,1954,Approved,"During the Korean War, a Navy fighter pilot must come to terms with his own ambivalence towards the war and the fear of having to bomb a set of highly defended bridges.",,12556
0047580,Trije novcici v vodnjaku,6.2,102,1954,Approved,"Three American women working in Rome, Italy share a spacious apartment and the desire to find love and marriage. Each one experiences a few bumps in her journey to romance.",,
0046808,Broken Lance,6.9,96,1954,Approved,"The saga of the Devereaux rancher family, set in 1880&apos;s Arizona.",2000000,
0047642,The Vanishing Prairie,7.1,71,1954,Approved,Story of the American prairie as it was when vast herds of bison and elk grazed there.,,
0048157,The Unconquered,7.0,55,1954,Approved,"This documentary chronicles the life of Helen Keller, who was struck by an illness as a young child that left her both blind and deaf. Aided by her devoted teacher, Anne Sullivan, Keller is able to develop ways to communicate and ...",,
0047585,Thursday&#x27;s Children,7.3,21,1954,Approved,"Won the Academy Award for the Best Documentary Short of 1954. The subject deals with the children at The Royal School for the Deaf in Margate, Kent. The hearing-handicapped children are shown painstakingly learning what words are ...",,
0047587,A Time Out of War,6.6,22,1954,,"A dramatic incident from the American Civil War when two Union soldiers and one Confederate soldier, facing each other at a battle front, agree on an hour&apos;s truce.",,
0047672,When Magoo Flew,6.3,6,1954,,Mr. Magoo sets off to go to the movies but goes to an airport by mistake and gets on a plane thinking it to be a theater. Little does Magoo know the man he is sitting next to is actually a thief and when a detective appears on the...,,
0047578,This Mechanical Age,6.6,10,1954,,A short documentary film chronicling the early days and failures of aviation.,,
0048445,Oklahoma!,7.0,145,1955,G,"In Oklahoma, several farmers, cowboys and a traveling salesman compete for the romantic favors of various local ladies.",5000000,16133
0048728,Ujeti tatu,7.4,106,1955,PG,A retired jewel thief sets out to prove his innocence after being suspected of returning to his former occupation.,2500000,7117
0048380,Mister Roberts,7.6,123,1955,Approved,"In the waning days of World War II, the cargo officer of a Navy supply ship chafes at its role far from the action in the Pacific&apos;s backwater areas, his frustration rising when its captain denies the crew liberty over petty irrita...",,
0048028,Vzhodno od raja,7.8,118,1955,PG,"Two brothers in 1910s California struggle to maintain the favor of their affectionate but strict, Bible-toting father as an old secret about their long-absent mother comes to light.",,29501
0048356,Marty,7.7,90,1955,Approved,A middle-aged butcher and a school teacher who have given up on the idea of love meet at a dance and fall for each other.,343000,
0048491,Picnic,7.0,115,1955,PG,Emotions are ignited among the complacent townsfolk when a handsome drifter arrives in a small Kansas community on the morning of the Labor Day picnic.,,
0048317,Love Me or Leave Me,7.1,122,1955,Approved,"A fictionalized account of the career of jazz singer Ruth Etting and her tempestuous marriage to gangster Marty Snyder, who helped propel her to stardom.",2760000,193
0048563,The Rose Tattoo,6.9,117,1955,Approved,A Sicilian seamstress who idolizes her husband must deal with several family crises upon his sudden death.,,
0048316,Love Is a Many-Splendored Thing,6.4,102,1955,Approved,A widowed Chinese-English doctor falls in love with a married American correspondent in Hong Kong during China&apos;s Communist Revolution.,1780000,29341
0048191,I&#x27;ll Cry Tomorrow,7.2,117,1955,Approved,"Susan Hayward stars as singer-actress Lillian Roth, whose rise to stardom was nearly destroyed by alcoholism.",2147000,
0048210,Interrupted Melody,6.7,106,1955,Approved,"This movie chronicles Australian-born opera star Marjorie Lawrence&apos;s success, her battle with polio, and her eventual career comeback.",2367000,
0048649,Speedy Gonzales,7.2,7,1955,Approved,Speedy Gonzales comes to the aid of a hungry group of mice trying to get the cheese from a factory guarded by Sylvester.,,
0049000,The Bespoke Overcoat,7.1,37,1955,,"Fender is a lowly clerk in the warehouse of clothing manufacturers Ranting and Co. His one ambition is to have an overcoat of his own. Refused one by the cold hearted Ranting he asks a tailor friend, Morry, to make him one instead...",5000,
0048369,Men Against the Arctic,5.6,30,1955,,Part of Walt Disney&apos;s People and Places series. This is the story of the &quot;Icebreakers&quot; - ships of very special construction that are built to make their way through the heavy Arctic ice packs on a trip to Thule.,,
0048677,Survival City,5.6,20,1955,,"Sinister sequels, eerie indies, and blockbuster boo-fests — here are the most exciting horror movies and shows to add to your Watchlist.",,
0049833,Deset zapovedi,7.9,220,1956,G,"Moses, raised as a prince of Egypt in the Pharaoh&apos;s household, learns of his true heritage as a Hebrew and his divine mission as the deliverer of his people from slavery.",13282712,65500755
0049261,Velikan,7.6,201,1956,G,Sprawling epic covering the life of a Texas cattle rancher and his family and associates.,5400000,32857066
0049470,"Mož, ki je vedel preveč",7.4,120,1956,PG,"An American doctor and his wife, a former singing star, witness a murder while vacationing in Morocco, and are drawn into a twisting plot of international intrigue when their young son is kidnapped.",2500000,10190
0048960,Around the World in Eighty Days,6.7,167,1956,G,A Victorian Englishman bets that with the new steamships and railways he can circumnavigate the globe in eighty days.,6000000,42009549
0049408,The King and I,7.4,133,1956,G,A widow accepts a job as a live-in governess to the King of Siam&apos;s children.,4550000,21321141
0049456,Sla po zivljenju,7.3,122,1956,Approved,The life of brilliant but tortured artist Vincent van Gogh.,3227000,
0049966,Zapisano v vetru,7.3,99,1956,Approved,"Alcoholic playboy Kyle Hadley marries the woman secretly loved by his poor but hard-working best friend, who in turn is pursued by Kyle&apos;s sister.",,14163
0049778,Somebody Up There Likes Me,7.5,113,1956,Approved,"Boxer Rocky Graziano&apos;s biopic, based on his autobiography, from childhood to his World Middleweight Championship title win at age 28 in 1947.",1920000,9528
0048947,Anastasia,7.0,105,1956,Approved,"An opportunistic businessman tries to pass off a mysterious impostor as the Grand Duchess Anastasia, and she is so convincing that even the biggest skeptics believe her.",3520000,
0048980,Le ballon rouge,8.1,34,1956,Not Rated,A red balloon with a mind of its own follows a little boy around the streets of Paris.,,48980
0049777,The Solid Gold Cadillac,7.5,99,1956,Approved,A minority stockholder takes on the crooked board of directors at a billion dollar corporation.,,
0049518,Le monde du silence,6.9,86,1956,,A documentary about the undersea explorers and how they penetrate into the underwater world.,,
0049030,The Brave One,6.5,100,1956,Approved,"A young boy named Leonardo adopts a bull after saving it during a storm, but their friendship is soon threatened by the legal owners of the animal who claim ownership of it and ship it off to the bullring to face a legendary bullf...",,
0049510,Magoo&#x27;s Puddle Jumper,5.4,6,1956,,"At a used car lot, Mr. Magoo is intent on buying a car for his nephew Waldo. He is slick talked into buying an old clunker thanks to a shifty salesman but he drives it off anyway. Unfortunately, the myopic Magoo drives off a pier ...",,
0049102,Crashing the Water Barrier,5.9,9,1956,Approved,"This Oscar-winning short documentary follows the exploits of Donald Campbell on Lake Mead, Nevada in his boat Bluebird as he attempts to be the first to successfully set a water speed record in excess of 200 mph.",,
0048049,The Face of Lincoln,6.2,20,1956,,"Head of the sculpture dpeartment at USC when this film was made (by USC), Merrell Gage was a lifelong expert on Abraham Lincoln. This short was a lecture often given by Gage, using wet clay to depict the on-going changes to Abe&apos;s ...",,
0050212,Most na reki Kwai,8.1,161,1957,PG,"British POWs are forced to build a railway bridge across the river Kwai for their Japanese captors in occupied Burma, not knowing that the allied forces are planning a daring commando raid through the jungle to destroy it.",3000000,27201366
0050783,Cabirijine noči,8.1,110,1957,Not Rated,A waifish prostitute wanders the streets of Rome looking for true love but finds only heartbreak.,,770764
0050356,Obračun na Atlantiku,7.4,98,1957,Approved,"During WWII an American destroyer discovers a German U-boat, and in the ensuing duel the American captain must draw upon all his experience to defeat the equally experienced German commander.",1910000,
0050933,Sayonara,7.0,147,1957,Approved,A US Air Force major in Kobe confronts his own opposition to marriages between American servicemen and Japanese women after he falls for a beautiful performer.,,
0051077,The Three Faces of Eve,7.2,91,1957,Approved,A doctor treats a woman suffering from Multiple Personality Disorder.,965000,
0050306,Designing Woman,6.7,118,1957,Approved,"A sportswriter and a fashion-designer marry after a whirlwind romance, and discover they have little in common.",,
0050631,Les Girls,6.6,114,1957,Approved,The former members of a dance troupe are suing because of recently published memoirs. Each one insists on own point of view.,,
0050569,The Joker Is Wild,7.0,126,1957,Approved,"Frank Sinatra plays Joe E. Lewis, a famous comedian of the 1930s-50s. When the movie opens, Lewis is a young, talented singer who performs in speakeasies. After he bolts one job for another, the mob boss who owns the first speakea...",,
0050194,Birds Anonymous,7.5,7,1957,Approved,"When Sylvester learns of the possibly dire consequences of his passion for birds, he joins Birds Anonymous to quit. Unfortunately, the outside world taxes his resolve to the limit.",,
0050109,Albert Schweitzer,6.1,85,1957,Approved,"This biographical drama/documentary narrative written by Dr. Albert Schweitzer and spoken by Fredric March, traces the life of Dr. Schweitzer (with actors playing the characters), from his birth in France up to about the age of 30...",,
0051187,The Wetback Hound,6.1,18,1957,,"Paco, a hound of exceptional heritage, is easily distracted by other animals while on the hunt.",,
0049885,The True Story of the Civil War,6.5,29,1957,,"Academy-Award winning short subject documentary that chronicles the Civil War through nearly 400 authentic artifacts, as opposed to using actors or sets.",,
