id,naslov,ocena,cas,leto,oznaka,opis,cena,zasluzek
0268126,Prilagajanje,7.7,115,2002,R,A lovelorn screenwriter becomes desperate as he tries and fails to adapt &apos;The Orchid Thief&apos; by Susan Orlean for the screen.,19000000,32802440
0287467,Govori z njo,7.9,112,2002,R,Two men share an odd friendship while they care for two women who are both in deep comas.,,64826117
0310793,Bowling za Columbine,8.0,120,2002,R,Filmmaker Michael Moore explores the roots of America&apos;s predilection for gun violence.,4000000,58015923
0331218,The Chubbchubbs!,7.3,6,2002,G,A janitor at an alien nightclub gets his wish to be a singer.,,
0340071,Der er en yndig mand,6.7,30,2002,,"Lars Hansen is in a job training program. He finds a potential job at a print shop, but his paperwork gets mixed up with an El Hassan. He is scheduled for a Danish class, since he&apos;s apparently an immigrant, but is unable to get th...",,
0299178,Thoth,6.8,40,2002,,Thoth is a street performer currently in New York. Thoth is an individual with a complicated life and background. Thoth plays on opera with a violin in a loincloth in Central Park. Thoth is.,,
0167260,Gospodar prstanov: Kraljeva vrnitev,9.0,201,2003,PG-13,Gandalf and Aragorn lead the World of Men against Sauron&apos;s army to draw his gaze from Frodo and Sam as they approach Mount Doom with the One Ring.,94000000,1138585547
0327056,Skrivnostna reka,7.9,138,2003,R,"The tragic murder of a 19-year-old girl reunites three childhood friends still living in Boston--the victim&apos;s gangster father, a detective, and the disturbed man they both suspect of killing her.",25000000,156595191
0266543,Reševanje malega Nema,8.2,100,2003,G,"After his son is captured in the Great Barrier Reef and taken to Sydney, a timid clownfish sets out on a journey to bring him home.",94000000,941637960
0335266,Izgubljeno s prevodom,7.7,102,2003,R,A fading movie star falls for a lonely young woman in Tokyo.,4000000,118688756
0159365,Hladni vrh,7.2,154,2003,R,"In the waning days of the American Civil War, a wounded soldier embarks on a perilous journey back home to Cold Mountain, North Carolina to reunite with his sweetheart.",79000000,173013509
0311113,Gospodar in bojevnik,7.5,138,2003,PG-13,"During the Napoleonic Wars, a brash British captain pushes his ship and crew to their limits in pursuit of a formidable French war vessel around South America.",150000000,211622535
0340855,Posast,7.3,109,2003,R,"Based on the life of Aileen Wuornos, a Daytona Beach prostitute who became a serial killer.",8000000,58469210
0317910,The Fog of War: Eleven Lessons from the Life of Robert S. McNamara,8.0,107,2003,PG-13,"The story of America as seen through the eyes of the former Secretary of Defense under President John F. Kennedy and President Lyndon B. Johnson, Robert McNamara.",,5038841
0338135,Vdor barbarov,7.5,99,2003,R,"During his final days, a dying man is reunited with old friends, former lovers, his ex-wife, and his estranged son.",6000000,34883010
0382734,Harvie Krumpet,7.9,23,2003,TV-14,"The odd biography of a man who has Tourette&apos;s Syndrome, chronic bad luck, menial jobs, nudist tendencies, and a book of &quot;fakts&quot; hung around his neck.",377000,
0388534,Wasp,7.5,26,2003,,A struggling single mother is determined not to let her four young children be an obstacle in the pursuit of starting a relationship with an old acquaintance.,,
0304858,Two Soldiers,7.0,40,2003,Not Rated,"Mississippi, just before Pearl Harbor. Two brothers, Pete, about 19 and Willie, about 10 years younger. They are clearly close friends. The news arrives, and Pete goes to enlist. Willie wants to come along, but is told he cannot. ...",,
0344503,Twin Towers,7.5,34,2003,18+,"Two brothers, one a firefighter, one a police officer, are remembered for their bravery in New York City on September 11.",,
0396959,Chernobyl Heart,7.8,39,2003,,This Academy Award-winning documentary takes a look at children born after the 1986 Chernobyl nuclear plant disaster who have been born with a deteriorated heart condition.,,
0338013,Večno sonce brezmadežnega uma,8.3,108,2004,R,"When their relationship turns sour, a couple undergoes a medical procedure to have each other erased from their memories forever.",20000000,73384095
0317705,Neverjetni,8.0,115,2004,PG,"While trying to lead a quiet suburban life, a family of undercover superheroes are forced into action to save the world.",92000000,631688498
0316654,Spider-Man 2,7.5,127,2004,PG-13,Peter Parker is beset with troubles in his failing personal life as he battles a former brilliant scientist named Otto Octavius.,200000000,784543400
0375679,Usodna nesreca,7.7,112,2004,R,"Los Angeles citizens with vastly separate lives collide in interweaving stories of race, loss and redemption.",6500000,98410061
0338751,Letalec,7.5,170,2004,PG-13,A biopic depicting the early years of legendary director and aviator Howard Hughes&apos; career from the late 1920s to the mid 1940s.,110000000,213719942
0405159,Punčka za milijon dolarjev,8.1,132,2004,PG-13,"Frankie, an ill-tempered old coach, reluctantly agrees to train aspiring boxer Maggie. Impressed with her determination and talent, he helps her become the best and the two soon form a close bond.",30000000,216763646
0375063,Stranpota,7.5,127,2004,R,"Two men reaching middle age with not much to show but disappointment embark on a week-long road trip through California&apos;s wine country, just as one is about to take a trip down the aisle.",16000000,109706931
0339291,Lemony Snicket: Zaporednje nesrecnih dogodkov,6.8,108,2004,PG,"When a massive fire kills their parents, three children are delivered to the custody of cousin and stage actor Count Olaf, who is secretly plotting to steal their parents&apos; vast fortune.",140000000,211468235
0350258,Ray,7.7,152,2004,PG-13,"The story of the life and career of the legendary rhythm and blues musician Ray Charles, from his humble beginnings in the South, where he went blind at age seven, to his meteoric rise to stardom during the 1950s and 1960s.",40000000,123971376
0308644,V iskanju dezele Nije,7.6,106,2004,PG,The story of Sir J.M. Barrie&apos;s friendship with a family who inspired him to create Peter Pan.,25000000,116650613
0318462,Diarios de motocicleta,7.7,126,2004,R,"Ernesto Guevara de la Serna, popularly known as Che, along with his friend Alberto Granado, decides to take a road trip across South America. His experiences on the journey transform him.",,57663711
0369702,Mar adentro,8.0,126,2004,PG-13,"The factual story of Spaniard Ramon Sampedro, who fought a 28-year campaign in favor of euthanasia and his own right to die.",10000000,43731621
0425458,Six Shooter,7.4,27,2004,Not Rated,"A black and bloody Irish comedy about a sad train journey where an older man, whose wife has died that morning, encounters a strange and possibly psychotic young oddball....",125000,
0388789,Born Into Brothels: Calcutta&#x27;s Red Light Kids,7.2,85,2004,R,"Two documentary filmmakers chronicle their time in Sonagchi, Calcutta and the relationships they developed with children of prostitutes who work the city&apos;s notorious red light district.",,3529201
0414469,Ryan,7.5,14,2004,TV-PG,"The movie talks about the life of Ryan Larkin, a gifted Canadian animator of the late &apos;60s and the early &apos;70s.",,
0443587,Mighty Times: The Children&#x27;s March,7.8,40,2004,,"On May 2, 1963, the children of Birmingham, Alabama took to the streets to challenge segregation.",,
0388795,Gora Brokeback,7.7,134,2005,R,"Two shepherds fall for each other, but their relationship becomes complicated when they both get married to their respective girlfriends.",14000000,178064141
0363771,"Zgodbe iz Narnije: Lev, carovnica in omara",6.9,143,2005,PG,"While playing, Lucy and her siblings find a wardrobe that lands them in a mystical place called Narnia. Here they realize that it was fated and they must now unite with Aslan to defeat an evil queen.",180000000,745013115
0360717,King Kong,7.2,187,2005,PG-13,"A greedy film producer assembles a team of moviemakers and sets out for the infamous Skull Island, where they find more than just cannibalistic natives.",207000000,556906378
0397535,Spomini gejse,7.3,145,2005,PG-13,"The heartwarming tale of Nitta Sayuri, a young Japanese woman who transcended from her fishing-village roots and became one of Japan&apos;s most celebrated geisha.",85000000,162242962
0358273,Hoja po robu,7.8,136,2005,PG-13,"A chronicle of country music legend Johnny Cash&apos;s life, from his early days on an Arkansas cotton farm to his rise to fame with Sun Records in Memphis, where he recorded alongside Elvis Presley, Jerry Lee Lewis, and Carl Perkins.",28000000,186797986
0387131,Zvesti vrtnar,7.3,129,2005,R,A widower&apos;s transcontinental quest to find answers about his wife&apos;s death leads him to explosive secrets.,25000000,82468097
0312004,Wallace in Gromit: Prekletstvo Strahouhca,7.5,85,2005,G,"Wallace and his loyal dog, Gromit, set out to discover the mystery behind the garden sabotage that plagues their village and threatens the annual giant vegetable growing contest.",30000000,192781882
0379725,Capote,7.3,114,2005,R,"In 1959, Truman Capote learns of the murder of a Kansas family and decides to write a book about the case. While researching for his novel In Cold Blood, Capote forms a relationship with one of the killers, Perry Smith, who is on ...",7000000,49327405
0365737,Syriana,6.9,128,2005,R,A politically charged epic about the state of the oil industry in the hands of those personally involved in and affected by it.,50000000,93974620
0410097,Gor in dol,7.3,116,2005,R,"With help from his friends, a Memphis pimp in a mid-life crisis attempts to become a successful hip-hop emcee.",2800000,23563727
0428803,La marche de l&#x27;empereur,7.5,80,2005,G,"In the Antarctic, every March since the beginning of time, the quest begins to find the perfect mate and start a family.",8000000,127392693
0468565,Tsotsi,7.2,95,2005,R,Six days in the violent life of a young Johannesburg gang leader.,3000000,9891303
0438575,West Bank Story,7.2,21,2005,,"A musical comedy set in the fast-paced, fast-food world of dueling falafel restaurants on the West Bank.",74000,
0491795,A Note of Triumph: The Golden Age of Norman Corwin,7.1,39,2005,,"A biography of Poet Norman Corwin, and the events surrounding his powerful radio broadcast commemorating VE Day on May 8, 1945.",50000,
0449619,The Moon and the Son: An Imagined Conversation,6.8,28,2005,G,"The Moon and the Son, a 30-minute autobiographical animated film by John Canemaker, explores the difficult emotional terrain of father/son relationships as seen through Canemaker&apos;s own turbulent relationship with his father. Featu...",,
0407887,Dvojna igra,8.5,151,2006,R,An undercover cop and a mole in the police attempt to identify each other while infiltrating an Irish gang in South Boston.,90000000,291481358
0457430,Favnov labirint,8.2,118,2006,R,"In 1944 Spain, a girl is sent to live with her ruthless stepfather. During the night, she meets a fairy who takes her to an old faun. He tells her she&apos;s a princess, but must prove her royalty by surviving three gruesome tasks.",19000000,83863565
0405094,Življenje drugih,8.4,137,2006,R,"In 1984 East Berlin, an agent of the secret police conducting surveillance on a writer and his lover finds himself becoming increasingly absorbed by their lives.",2000000,77672685
0449059,Nasa mala mis,7.8,101,2006,R,A family determined to get their young daughter into the finals of a beauty pageant take a cross-country trip in their VW bus.,8000000,101059571
0383574,Pirati s Karibov: Mrtveceva skrinja,7.4,151,2006,PG-13,"Jack Sparrow races to recover the heart of Davy Jones to avoid enslaving his soul to Jones&apos; service, as other friends and foes seek the heart for their own agenda as well.",225000000,1066179747
0422720,Marie Antoinette,6.5,123,2006,PG-13,"The retelling of France&apos;s iconic but ill-fated queen, Marie Antoinette. From her betrothal and marriage to Louis XVI at 14 to her reign as queen at 19 and to the end of her reign as queen, and ultimately the fall of Versailles.",40000000,60917189
0449467,Babilon,7.5,143,2006,R,"Tragedy strikes a married couple on vacation in the Moroccan desert, which jump starts an interlocking story involving four different families.",25000000,135330835
0455590,Zadnji skotski kralj,7.6,123,2006,R,Based on the events of the brutal Ugandan dictator Idi Amin&apos;s regime as seen by his personal physician during the 1970s.,6000000,55758874
0366548,Vesele nogice,6.4,108,2006,PG,"Into the world of the Emperor Penguins, who find their soul mates through song, a penguin is born who cannot sing. But he can tap dance something fierce!",100000000,384336781
0498380,Pisma z Iwo Jime,7.8,141,2006,R,"The story of the battle of Iwo Jima between the United States and Imperial Japan during World War II, as told from the perspective of the Japanese who fought it.",19000000,68673228
0907657,Once,7.8,86,2006,R,"A modern-day musical about a busker and an immigrant and their eventful week in Dublin, as they write, rehearse and record songs that tell their love story.",150000,22312089
0436697,Kraljica,7.3,103,2006,PG-13,"After the death of Princess Diana, Queen Elizabeth II struggles with her reaction to a sequence of events nobody could have predicted.",9800000,124925340
0443489,Sanjske punce,6.6,130,2006,PG-13,"A trio of black female soul singers cross over to the pop charts in the early 1960s, facing their own personal struggles along the way.",70000000,155456301
0497116,Neprijetna resnica,7.4,96,2006,PG,"Filmmaker Davis Guggenheim follows Al Gore on the lecture circuit, as the former presidential candidate campaigns to raise public awareness of the dangers of global warming and calls for immediate action to curb its destructive ef...",1500000,49782012
0863136,Peter &amp; the Wolf,7.5,32,2006,G,An animated retelling set to Prokofiev&apos;s suite.,2000000,
0933357,The Danish Poet,7.5,15,2006,,A woman ponders over the strange coincidences that made her forefathers and -mothers meet and create the premises for her becoming the person that she is.,,
0820971,Le Mozart des pickpockets,7.0,31,2006,,Two pickpockets have to take care of a deaf-mute Romanian child.,,
0859595,The Blood of Yingzhou District,7.3,38,2006,Not Rated,"A year in the life of children in the Province of Anhui in China, who have lost their parents to AIDS. Traditional obligations to family and village collide with terror of the disease.",250000,
0477348,Ni prostora za starce,8.2,122,2007,R,Violence and mayhem ensue after a hunter stumbles upon the aftermath of a drug deal gone wrong and over two million dollars in cash near the Rio Grande.,25000000,171632777
0783233,Pokora,7.8,123,2007,R,Thirteen-year-old fledgling writer Briony Tallis irrevocably changes the course of several lives when she accuses her older sister&apos;s lover of a crime he did not commit.,30000000,129266061
0469494,Tekla bo kri,8.2,158,2007,R,"A story of family, religion, hatred, oil and madness, focusing on a turn-of-the-century prospector in the early days of the business.",25000000,76430381
0382932,Ratatouille,8.1,111,2007,G,A rat who can cook makes an unusual alliance with a young kitchen worker at a famous Paris restaurant.,150000000,623729380
0467406,Juno,7.4,96,2007,PG-13,"Faced with an unplanned pregnancy, an offbeat young woman makes a selfless decision regarding the unborn child.",7500000,232373066
0465538,Michael Clayton,7.2,119,2007,R,A law firm brings in its &quot;fixer&quot; to remedy the situation after a lawyer has a breakdown while representing a chemical company that he knows is guilty in a multibillion-dollar class action suit.,25000000,92991835
0408236,Sweeney Todd: Hudicev brivec,7.3,116,2007,R,"The legendary tale of a barber who returns from wrongful imprisonment to 1840s London, bent on revenge for the rape and death of his wife, and resumes his trade while forming a sinister partnership with his fellow tenant, Mrs. Lov...",50000000,153384272
0440963,Bournov ultimat,8.0,115,2007,PG-13,Jason Bourne dodges a ruthless C.I.A. official and his Agents from a new assassination program while searching for the origins of his life as a trained killer.,110000000,442824138
0385752,Zlati kompas,6.1,113,2007,PG-13,"In a parallel universe, young Lyra Belacqua journeys to the far North to save her best friend and other kidnapped children from terrible experiments by a mysterious organization.",180000000,372234864
0414055,Elizabeth: The Golden Age,6.8,114,2007,PG-13,"A mature Queen Elizabeth endures multiple crises late in her reign including court intrigues, an assassination plot, the Spanish Armada, and romantic disappointments.",55000000,75782758
0450188,Zivljenje V Roznatem,7.5,140,2007,PG-13,"Biopic of the iconic French singer Édith Piaf. Raised by her grandmother in a brothel, she was discovered while singing on a street corner at the age of 19. Despite her success, Piaf&apos;s life was filled with tragedy.",25000000,87485236
0813547,Die Fälscher,7.5,99,2007,R,"The story of the Operation Bernhard, the largest counterfeiting operation in history, carried out by Germany during World War II.",4200000,18814713
0854678,Taxi to the Dark Side,7.5,106,2007,R,Alex Gibney exposes the haunting details of the USA&apos;s torture and interrogation practices during the War in Afghanistan.,1000000,294309
1280548,Spielzeugland,7.7,14,2007,TV-PG,A German mother lies to her son about where the Nazis are sending their Jewish neighbors.,,
0914369,Freeheld,7.7,39,2007,Not Rated,"In the last weeks of her life, Lieutenant Laurel Hester has one goal - to leave her hard-earned pension to her life partner Stacie. Without it, Stacie will lose their house. For once the law is not on Laurel&apos;s side. Time is runnin...",,
0468569,Vitez teme,9.0,152,2008,PG-13,"When a menace known as the Joker wreaks havoc and chaos on the people of Gotham, Batman, James Gordon and Harvey Dent must work together to put an end to the madness.",185000000,1012558979
0910970,Wall-E,8.4,98,2008,G,"A robot who is responsible for cleaning a waste-covered Earth meets another robot and falls in love with her. Together, they set out on a journey that will alter the fate of mankind.",180000000,527403656
0421715,Nenavaden primer Benjamina Buttona,7.8,166,2008,PG-13,"Benjamin Button, born in 1918 with the physical state of an elderly man, ages in reverse. He experiences love and break-ups, ecstasy and sorrow, and timelessness by the time he dies in 2003 as a baby.",150000000,335802786
0976051,Bralec,7.6,124,2008,R,"Post-WWII Germany: Nearly a decade after his affair with an older woman came to a mysterious end, law student Michael Berg re-encounters his former lover as she defends herself in a war-crime trial.",32000000,108902486
0887912,Bombna misija,7.5,131,2008,R,"During the Iraq War, a Sergeant recently assigned to an army bomb squad is put at odds with his squad mates due to his maverick way of handling his work.",15000000,49259766
1010048,Revni milijonar,8.0,120,2008,R,"When a teenager from the slums of Mumbai is interrogated about his suspicious performance on a quiz show, he revisits various events from his past to explain how he knew all the answers.",15000000,378411362
0497465,Ljubezen v Barceloni,7.1,96,2008,PG-13,"Two friends on a summer holiday in Spain become enamored with the same painter, unaware that his ex-wife, with whom he has a tempestuous relationship, is about to re-enter the picture.",15500000,96409830
0864761,Vojvodina,6.9,110,2008,PG-13,"A chronicle of the life of 18th-century aristocrat Georgiana, Duchess of Devonshire, who was revered for her extravagant political and personal life.",13500000,43343384
1013753,Milk,7.5,128,2008,R,"The story of American gay activist Harvey Milk, who fought for gay rights and was elected as California&apos;s first openly gay official.",20000000,54662930
1069238,Okuribito,8.0,130,2008,PG-13,"Soon after buying an expensive cello, Daigo learns that his orchestra is disbanding. He moves back to his hometown with his wife, where he answers an ad for what Daigo thinks is a travel agency but is, in actuality, a mortuary.",,74236951
1155592,Clovek na zici,7.7,94,2008,PG-13,"A look at tightrope walker Philippe Petit&apos;s daring, but illegal, high-wire routine performed between New York City&apos;s World Trade Center&apos;s twin towers in 1974, what some consider, &quot;the artistic crime of the century&quot;.",1000000,5258569
1361566,Tsumiki no ie,8.2,12,2008,Not Rated,"To save his house from rising flood waters, an old man uses bricks to build it higher, then he relives events from his past while searching for his dropped pipe.",,
1360065,Smile Pinki,7.8,39,2008,,"A real-world fairy-tale about the journey of Pinki and Ghutaru, two children in rural India whose lives are forever changed by a simple surgery they never imagined possible.",,
0361748,Neslavne barabe,8.4,153,2009,R,"In Nazi-occupied France during World War II, a plan to assassinate Nazi leaders by a group of Jewish U.S. soldiers coincides with a theatre owner&apos;s vengeful plans for the same.",70000000,321460744
0499549,Avatar,7.9,162,2009,PG-13,A paraplegic Marine dispatched to the moon Pandora on a unique mission becomes torn between following his orders and protecting the world he feels is his home.,237000000,2923710708
0796366,Zvezdne steze,7.9,127,2009,PG-13,The brash James T. Kirk tries to live up to his father&apos;s legacy with Mr. Spock keeping him in check as a vengeful Romulan from the future creates black holes to destroy the Federation one planet at a time.,150000000,385681768
1305806,Skrivnost njihovih oči,8.2,129,2009,R,A retired legal counselor writes a novel hoping to find closure for one of his past unresolved homicide cases and for his unreciprocated love with his superior - both of which still haunt him decades later.,2000000,35079650
1049413,V višave,8.3,96,2009,PG,"78-year-old Carl Fredricksen travels to South America in his house equipped with balloons, inadvertently taking a young stowaway.",175000000,735103954
0878804,Zgodba o prvaku,7.6,129,2009,PG-13,"The story of Michael Oher, a homeless and traumatized boy who became an All-American football player and first-round NFL draft pick with the help of a caring woman and her family.",29000000,309231694
0929632,Zivljenje je dragoceno,7.3,110,2009,Not Rated,"In New York City&apos;s Harlem circa 1987, an overweight, abused, illiterate teen who is pregnant with her second child is invited to enroll in an alternative school in hopes that she can re-route her life in a better direction.",10000000,63649529
1263670,Noro srce,7.2,112,2009,R,A faded country music musician is forced to reassess his dysfunctional life during a doomed romance that also inspires him.,7000000,47405566
0962736,Mlada Viktorjia,7.2,105,2009,PG,"A dramatization of the turbulent first years of Queen Victoria&apos;s rule, and her enduring romance with Prince Albert.",35000000,29196409
1313104,The Cove,8.4,92,2009,PG-13,"Using state-of-the-art equipment, a group of activists, led by renowned dolphin trainer Ric O&apos;Barry, infiltrate a cove near Taijii, Japan to expose both a shocking instance of animal abuse and a serious threat to human health.",,1187434
1520428,The New Tenants,6.8,21,2009,TV-14,"A nosy neighbor, a drug dealer and an angry husband make for a move-in day that two men will never forget.",,
1563725,Logorama,7.5,16,2009,R,Police chase an armed criminal in a version of Los Angeles comprised entirely of corporate logos.,,
1375666,Izvor,8.8,148,2010,PG-13,"A thief who steals corporate secrets through the use of dream-sharing technology is given the inverse task of planting an idea into the mind of a C.E.O., but his tragic past may doom the project and his team to disaster.",160000000,839381898
0947798,Crni labod,8.0,108,2010,R,"Nina is a talented but unstable ballerina on the verge of stardom. Pushed to the breaking point by her artistic director and a seductive rival, Nina&apos;s grip on reality slips, plunging her into a waking nightmare.",13000000,329398046
1285016,Socialno omrezje,7.8,120,2010,PG-13,"As Harvard student Mark Zuckerberg creates the social networking site that would become known as Facebook, he is sued by the twins who claimed he stole their idea and by the co-founder who was later squeezed out of the business.",40000000,224927749
1014759,Alice se vrne v čudežno deželo,6.4,108,2010,PG,"Nineteen-year-old Alice returns to the magical world from her childhood adventure, where she reunites with her old friends and learns of her true destiny: to end the Red Queen&apos;s reign of terror.",200000000,1025468216
0435761,Svet igrač 3,8.3,103,2010,G,"The toys are mistakenly delivered to a day-care center instead of the attic right before Andy leaves for college, and it&apos;s up to Woody to convince the other toys that they weren&apos;t abandoned and to return home.",200000000,1067316101
1504320,Kraljev govor,8.0,118,2010,R,"The story of King George VI, his unexpected ascension to the throne of the British Empire in 1936, and the speech therapist who helped the unsure monarch overcome his stammer.",15000000,471155448
0964517,Borec,7.8,116,2010,R,"Based on the story of Micky Ward, a fledgling boxer who tries to escape the shadow of his more famous but troubled older boxing brother and get his own shot at greatness.",25000000,129190869
0780653,Volkodlak,5.9,103,2010,R,"Upon his return to his ancestral homeland, an American man is bitten and subsequently cursed by a werewolf.",150000000,139789765
1645089,Inside Job,8.2,109,2010,PG-13,Takes a closer look at what brought about the 2008 financial meltdown.,2000000,7871522
